183,431c0dae19eec491ed27f81d007c7a12,rippin.jamey,Anika,Hamill,kveum@example.net,1989-10-04 02:11:46,"Et excepturi dicta et assumenda esse voluptatem alias. Quo quia molestiae omnis vero sit sed. Asperiores ut quis est porro cum nesciunt. Sit tempore dolorem ut officiis dolorum.

Perspiciatis libero vel repellat labore. A distinctio ut ducimus qui voluptas fugit. Delectus enim rerum itaque quisquam at sit repellat sit. Consequatur illum harum ipsum voluptas vel.",Nigeria,Edo,,"993 Wilhelmine Fields Suite 856
East Myrna, VA 64236",352-558-1341 x25117,,,7,47607,90771,,,2018-05-14 11:51:39,2018-05-14 11:51:39
184,c5cc2b53a91e038cfe7f1108e800091a,fklocko,Terrance,Jast,adelbert.pfeffer@example.com,1994-12-03 03:44:12,"Quasi numquam laudantium eum et numquam quos rerum. Reprehenderit quisquam ex modi. Incidunt vitae ullam adipisci possimus amet expedita.

Veniam sint est sunt libero et et eaque dolores. Repellendus est excepturi amet amet modi quaerat. Hic est magni deleniti.",Nigeria,Ondo,,"862 Barton Glen Suite 379
Coleshire, NC 24949-0570",+16954121419,,,4,49040,52237,,,2018-05-14 11:51:39,2018-05-14 11:51:39
185,99ee9c48842b7b0f21719cd26a6eef3b,thea33,Ansley,Wisozk,swaniawski.lisa@example.org,1995-11-12 16:02:43,"Aspernatur numquam ipsum est. Cupiditate minima soluta et non perspiciatis aut. Vitae qui veniam aut libero quisquam repellendus. Labore ipsam numquam quod repudiandae.

Fuga rem perferendis dolores. Dolorem voluptate omnis est minima. Voluptate nostrum maiores eum voluptatibus veritatis repellendus. Explicabo quis natus adipisci aperiam id nemo.",Nigeria,Plateau,,"1922 Stiedemann Vista
North Elisemouth, ME 84331",1-532-504-3035 x50483,,,0,46191,85457,,,2018-05-14 11:51:39,2018-05-14 11:51:39
186,b10c0f1661137a8b4b81f62e65a54d8d,fbergnaum,Lewis,Littel,cassin.mollie@example.net,1987-02-02 22:46:59,"Aut expedita omnis labore. Et aliquid nihil placeat. Sapiente voluptatem ab eius ut sed quo sit sit. Minima dolorem deleniti et est dolor.

Odit sed et eveniet ut harum debitis voluptas quis. Ut praesentium facere accusantium rerum corporis esse voluptatum. Laboriosam quo dolores omnis odio. Eius corrupti ea ipsum enim non eos facere.",Nigeria,Jigawa,,"995 Armando Islands Apt. 493
Kennethstad, KS 26509-3500",579.399.6178 x3075,,,5,49488,72861,,,2018-05-14 11:51:39,2018-05-14 11:51:39
187,44171560b308c1b5b6e2f43ec7e62e12,leta.schaefer,Akeem,Yundt,alden25@example.org,1996-06-30 21:58:12,"Nisi repellat voluptatem voluptatem perspiciatis similique molestiae. Ducimus ut quaerat ut veritatis fugit velit. Non delectus tempore quia repellendus illo.

Atque earum nesciunt facere ut aliquam quod. Quis accusantium quisquam nesciunt sit. Ipsa sed aliquid in ea.",Nigeria,Ekiti,,"19008 Bartoletti Knolls
Hellerburgh, CA 40065-0895",+15894919244,,,4,34413,90146,,,2018-05-14 11:51:40,2018-05-14 11:51:40
188,038f2b4b1927347455a7d34de7758557,weldon.hermann,Wanda,O'Kon,janice04@example.net,1988-07-28 17:40:39,"Veritatis consectetur qui ut alias animi totam qui sunt. Sed facere delectus qui. Voluptas blanditiis optio velit veniam delectus ipsa. Voluptatibus necessitatibus unde voluptatibus qui vel nihil ipsum.

Ut et qui provident est et doloribus laudantium. Assumenda et quaerat incidunt aut. Harum sed accusantium asperiores tempora. Reprehenderit sunt officia repellendus et et.",Nigeria,Benue,,"586 Orval Brook Suite 287
North Karianneview, MD 09656",1-562-346-6493 x578,,,5,49208,51318,,,2018-05-14 11:51:40,2018-05-14 11:51:40
189,803d6ef2be2ba55b710b376ba03f0514,gladyce.heidenreich,Joanny,Howell,hilton.hilll@example.com,1995-02-14 09:34:38,"Porro ipsum quia minima. Sapiente omnis ut officiis architecto illum. Amet iste modi voluptatem mollitia aperiam occaecati.

Ut ipsum cumque aperiam vero. Dolore reprehenderit et quam quidem eos eveniet. Inventore ab earum consectetur nihil natus.",Nigeria,Bayelsa,,"8201 Kelvin Crossroad
Goodwinberg, ME 30800",(976) 620-3023 x766,,,2,31440,72151,,,2018-05-14 11:51:40,2018-05-14 11:51:40
190,a6adff04cc91e0203f56281ef14950e6,mertie.hermiston,Newell,Schroeder,cathy04@example.com,1993-10-28 17:58:41,"Necessitatibus nisi dolores et ipsum. Eos velit omnis voluptatem rerum provident. Mollitia sunt voluptatibus sed et laboriosam.

Quo quia quia voluptatem itaque et corporis enim. In delectus et eum hic officia molestias. Voluptatum sit earum at iusto.",Nigeria,Oyo,,"123 Hayes Points
Patricktown, WA 04160-1962",946-699-9093 x686,,,9,44665,95831,,,2018-05-14 11:51:40,2018-05-14 11:51:40
191,37d0f342fd81dd0a9e1ea2e1180dcb5e,wilburn.brekke,Cody,Durgan,gislason.jaunita@example.com,1994-07-06 15:14:53,"Et corporis quae ut voluptatem aliquam temporibus doloremque. Rerum et natus saepe quos. Et quasi assumenda inventore.

Consequuntur expedita facilis facilis quis molestiae quidem ipsam. Facilis ut natus velit eveniet earum. Rem vel saepe cumque quae. Commodi tempora id ex placeat maxime quam.",Nigeria,Taraba,,"127 Schamberger Union
Smithside, GA 52508-4975",(453) 402-3294 x7233,,,4,38411,60542,,,2018-05-14 11:51:40,2018-05-14 11:51:40
192,57716b27be0e4ad05bdd4322bfa03b4b,odessa21,Hal,Quigley,rosemarie84@example.com,1989-08-18 07:45:53,"Nobis modi in ut et mollitia fugit quibusdam. Qui dolor ducimus eius ut quaerat libero. Et magni laboriosam facilis unde incidunt at perspiciatis.

Nulla aut ea vitae explicabo alias eius. Impedit et soluta fugiat qui ratione. Excepturi vel illum voluptatem consectetur nobis ullam nihil. Quas voluptas hic error ut.",Nigeria,Kano,,"518 Gutkowski Causeway Apt. 741
East Shyanne, TX 89557-1137",663.601.3200 x38993,,,9,40432,65799,,,2018-05-14 11:51:41,2018-05-14 11:51:41
193,03d41eb4adbbc82b30a09f10d1cab776,carolyne.langosh,Lera,Fahey,davis.laurel@example.org,1997-06-19 04:07:53,"Consequatur tenetur et placeat tempore illum amet. Sed et alias nemo esse est ipsam. Odit explicabo consectetur neque praesentium facilis.

Assumenda eius et iusto asperiores corrupti. Veniam qui reiciendis aliquam esse explicabo. Cum reprehenderit quis ab sed sit. Fugit nulla praesentium quas esse. Quos maiores dolore omnis.",Nigeria,Sokoto,,"93062 Shields Shoal Suite 909
North Domingo, IN 53670-0244",1-636-649-8576,,,10,36083,51946,,,2018-05-14 11:51:41,2018-05-14 11:51:41
194,5dc42374b4966775d91a0463ad5362ce,uconsidine,Tevin,Hills,jaeden.herzog@example.net,1983-12-20 17:23:12,"Cumque fugit pariatur dolores voluptatem esse fugit. Ut assumenda sunt dolor qui et. Nihil modi fugit et voluptates modi sit a. Sint quaerat enim molestias a vitae facere.

Dolor consequatur tenetur eum et. Id sit ratione eius aperiam suscipit. Ea vel vel ullam iusto. Iusto est perferendis nemo magni.",Nigeria,Gombe,,"57839 Ryan Freeway Apt. 315
Schulistland, SC 08725",993-625-0394 x142,,,1,33929,82388,,,2018-05-14 11:51:41,2018-05-14 11:51:41
195,ffdbdcc741ef1e154e2c670553a6a587,delia.wolff,Katlyn,Swift,richard.hagenes@example.net,1998-01-22 12:05:30,"Consequatur neque aperiam qui optio. Voluptates velit quia soluta eum consequatur ipsam officiis nesciunt. Omnis ut vel provident possimus totam voluptatem occaecati. Perferendis et et a aut.

Et doloremque quia quo rerum aut veniam nihil. Est fugiat tempora cum voluptates repudiandae dolores id. Aut eum consequuntur nulla atque ut quis.",Nigeria,Kano,,"5612 McLaughlin Field
New Chanelstad, OK 38333-1741",465.402.2926 x975,,,3,30509,95907,,,2018-05-14 11:51:41,2018-05-14 11:51:41
196,4530a2bfd597b0e5f88ef5585550c067,evelyn55,Naomie,Purdy,zboncak.chad@example.net,1989-11-07 21:44:37,"Sequi ut aut culpa enim rem vel. Eum et repellat harum voluptatem quo asperiores. Quia nam dolorem aliquid hic.

Vitae accusantium aut beatae error possimus. Nemo atque sapiente quo minima. Amet voluptates aperiam magnam deleniti sed labore voluptatem. Debitis quia totam qui occaecati aliquid dolores illum eligendi.",Nigeria,Adamawa,,"54525 Chelsie Cove Apt. 297
West Deontaeshire, MO 32082",903.490.7507,,,8,33247,67838,,,2018-05-14 11:51:41,2018-05-14 11:51:41
197,49f4367b9004c8682d03b8ee4fa2161d,ullrich.evalyn,Aubrey,Haag,jena15@example.net,1988-08-08 03:45:28,"Reprehenderit optio officiis est autem quibusdam. Qui ut aliquid labore aliquam sed est. Et omnis libero quos labore nulla qui consequatur animi.

Fuga ab optio quibusdam facilis qui id. Iusto quam quas hic aut consectetur quae. Nostrum est est similique molestiae. Non similique reiciendis velit nihil.",Nigeria,Kebbi,,"385 Stoltenberg Loaf Apt. 395
Lake Glen, MA 55498",327-330-3306 x548,,,3,39847,50983,,,2018-05-14 11:51:41,2018-05-14 11:51:41
198,3a3205d4d327ea6c68706f403cb1fa2e,deondre27,Leon,Trantow,mzieme@example.net,1998-02-17 20:50:42,"Incidunt quas fugit et cupiditate totam alias aut. Totam sapiente ut veritatis sed. Est sint quia ea dolores recusandae non. Ea aut dolorum exercitationem rem dolor distinctio.

Nihil qui minus vel aut commodi. Rem eaque aut soluta optio. Dolor minus eaque voluptatem et est vero id. Delectus eaque ut architecto perferendis tempore ipsa natus.",Nigeria,Yobe,,"3243 Smitham Pass
North Luellaview, CT 78692",(275) 950-8535 x07518,,,6,36474,99912,,,2018-05-14 11:51:42,2018-05-14 11:51:42
199,39bb0a6c00c9b73e304ca26245ed902e,sreichert,Tyshawn,Ernser,ptorp@example.com,1993-09-09 13:05:46,"Magni officia aut ut totam. Nam eveniet illum accusamus ipsum. Explicabo est aliquam aut voluptas repellendus aut laudantium. Dignissimos officia neque neque ea.

Quas facere incidunt libero blanditiis. In qui et eius iste commodi modi sunt. Autem aut sit officia voluptas et qui qui. Sint molestias ratione at delectus.",Nigeria,Enugu,,"552 Tracy Station
North Abel, ID 60271",715.426.1587,,,6,45936,77380,,,2018-05-14 11:51:42,2018-05-14 11:51:42
200,6bba0df78e9b122351089255b68bf609,candido19,Lelia,Stamm,bertrand.heaney@example.org,1990-09-12 18:40:31,"Non eum dolor tempora omnis occaecati et nemo. Voluptas molestiae omnis error dolor.

Excepturi ullam nihil porro dolores dolor. Omnis quidem vitae ad. Sed sint est architecto ducimus id sed vero.",Nigeria,Delta,,"94013 Linnea Groves
Considineton, RI 81606",1-942-386-4595,,,5,47916,78783,,,2018-05-14 11:51:42,2018-05-14 11:51:42
201,90f66a1e132731a62e4fd166ffaccd9c,carli.carroll,Lambert,Kub,handerson@example.com,1997-11-21 01:35:18,"Exercitationem corporis dolore omnis neque aliquam molestiae. Sint dolorum incidunt et officia debitis nihil quaerat qui. Omnis qui incidunt est nulla qui modi impedit. Quia necessitatibus blanditiis sit eveniet harum sunt placeat.

Aliquid occaecati molestiae perspiciatis minus qui quas. Voluptas ab quisquam et et qui dignissimos. Doloribus natus ab rem ut ut in eum.",Nigeria,Taraba,,"341 Fritsch Via
New Lenna, MD 47364-2748",458.352.8938 x214,,,10,47854,93918,,,2018-05-14 11:51:42,2018-05-14 11:51:42
202,e185c5b8b4f0c24b4f7569795ee37875,watsica.zora,Ernest,Larson,karley56@example.net,1995-11-28 18:13:18,"Dolor id minima sit facere. Qui velit corrupti quia. Ut ut repudiandae iste molestias.

Ut autem dicta delectus est quia. Sint nam laborum aut. Incidunt ducimus facere quod voluptatem soluta aut eaque.",Nigeria,Edo,,"1368 Dejuan Gardens Suite 823
Josephhaven, MS 82482-8841",468.635.3235 x7577,,,5,38578,51308,,,2018-05-14 11:51:42,2018-05-14 11:51:42
203,991ec973c661bc44fb6b1764cc582128,ernestina11,Rae,Klein,quigley.vada@example.net,1995-04-26 16:57:22,"Quod aut minima autem ipsa eos aut earum. Neque modi adipisci consequatur quae. Placeat et consequatur dolores dicta nihil sunt eaque cum. Rem exercitationem quia et nemo inventore beatae.

Aliquid aut odit alias repellat. Et asperiores provident voluptates id sed eos sapiente. Rem cumque fuga adipisci doloribus. Aut quod voluptatem cum. Voluptatum sunt reprehenderit quae ex hic.",Nigeria,Plateau,,"261 Beier Tunnel
Schowalterport, GA 58555",(747) 967-3111 x073,,,3,34162,64557,,,2018-05-14 11:51:42,2018-05-14 11:51:42
204,b33107b4b9aa56e400c4bead1d835f6b,lubowitz.nadia,Carrie,Franecki,eda75@example.net,1985-08-12 00:56:21,"Nisi necessitatibus quam ex neque et. Autem rerum excepturi ratione adipisci rem. Dolorum ut debitis hic aut et dolores adipisci.

Cupiditate aliquam aut rem. Eum itaque et doloribus at neque non quibusdam. Alias delectus nesciunt soluta eaque incidunt. Officia aut itaque repellat nihil error minus dolores. Aut porro ducimus maxime.",Nigeria,Benue,,"63977 Dovie Views
Adrienneburgh, ME 52738-6365",+1-529-577-4249,,,8,49101,73888,,,2018-05-14 11:51:43,2018-05-14 11:51:43
205,c7a9adfaa311268ad8f301211fcba09d,dsmith,Tillman,Yundt,jermaine.moore@example.net,1992-07-17 06:44:44,"Error beatae eum et sed omnis delectus molestiae. Est facilis mollitia voluptatem quibusdam. Rerum dolor repellendus provident impedit.

Fuga tempore et saepe omnis. Ea voluptates impedit officia sunt doloribus tenetur omnis. Sit rerum quod consectetur reprehenderit.",Nigeria,Taraba,,"243 Schumm Landing
New Felipa, SC 36062",637.255.2331 x406,,,3,33938,88803,,,2018-05-14 11:51:43,2018-05-14 11:51:43
206,b2c40007926a9fab1c65f95bf86c7694,tschowalter,Lillie,Hilpert,lynch.archibald@example.org,1986-02-07 10:30:21,"Aperiam et sit est. Nemo aliquid harum cumque ratione voluptas et.

Soluta ut consequatur fuga consequatur sit quaerat. Quia non deleniti eos ea qui saepe dolor. Dolores velit deserunt atque ab.",Nigeria,Bauchi,,"80982 Nitzsche Estate Suite 508
Rockyfort, PA 06932-0371",223-447-4699,,,4,43222,56665,,,2018-05-14 11:51:43,2018-05-14 11:51:43
207,4c9cbb4f4cacfc1cfde503369ea521e3,caterina55,Taylor,Crona,garry.cormier@example.org,1993-11-27 06:32:18,"Aut possimus deserunt iste magnam consequuntur. Eum molestias non dolore et dignissimos laboriosam voluptas maiores. Amet optio vel dolorem dignissimos repellendus.

Iste quae molestiae doloribus consectetur explicabo. Explicabo qui est laboriosam quo alias tempore voluptate. Aut consequatur quia eligendi voluptas voluptatem nihil natus. Tenetur repudiandae et fuga.",Nigeria,Katsina,,"54393 Bosco Meadow
Millschester, OH 45869",723-851-6900 x1590,,,2,32871,78466,,,2018-05-14 11:51:43,2018-05-14 11:51:43
208,5fc95747b49f904da45aad6d2384e0c0,carley.bailey,Randal,Schimmel,tkuhlman@example.com,1997-06-12 04:25:55,"Sapiente ea consequatur laudantium et dignissimos sunt aspernatur. Eligendi facere atque tenetur sed quaerat. Aliquid et vitae voluptatem architecto. Velit quis labore aperiam consectetur.

Corporis consectetur sed sunt sunt quia eos laborum odit. Esse tempore id odio a alias temporibus et.",Nigeria,Anambra,,"720 Gay Throughway
Barrowsshire, AZ 70949-2984",963.882.0047 x5083,,,10,32114,51332,,,2018-05-14 11:51:43,2018-05-14 11:51:43
209,b6e245c01a56666a7464c589cc45a945,nbailey,Ollie,Johnston,kuhic.enrique@example.org,1985-09-13 02:12:31,"Qui cupiditate ratione adipisci sapiente voluptatum consectetur sit. Ad voluptatem architecto sit corrupti optio.

Sunt ut consequuntur excepturi aut. Et nemo quisquam inventore consectetur. Inventore debitis nihil ducimus corporis. Dolor et a quaerat amet voluptatem harum non.",Nigeria,Ebonyi,,"551 Gladyce Street
Smithamberg, NC 33549-0135",965.251.0951,,,10,45284,96850,,,2018-05-14 11:51:43,2018-05-14 11:51:43
210,6e0f851bc98e76f8e65f28ebf89f2c71,jodie.lebsack,Margot,Deckow,elvie.wiza@example.net,1990-05-08 10:45:38,"Numquam laborum quaerat dolorum rerum. Eos laborum sunt ipsum non sed est beatae. Est est fugit sint placeat sed et.

Et odio velit non quo. Temporibus nesciunt recusandae ab nesciunt vitae sed eum aut. Alias quos ut non beatae libero. Quaerat voluptatem dolore praesentium quod.",Nigeria,Zamfara,,"81818 Antonetta Ports
West Wilburnview, MS 94132-4415",+1-696-276-6339,,,5,35714,62595,,,2018-05-14 11:51:44,2018-05-14 11:51:44
211,a085f01b3d9ea057557eb02fda05c2f1,grempel,Loyce,Jacobs,stark.daija@example.com,1988-07-02 06:50:59,"Quaerat excepturi vel tenetur aperiam ut et. Officia dignissimos ab expedita amet facere illum. Autem illo explicabo excepturi similique.

Autem sit laboriosam ea omnis est. Ratione maxime quod esse quasi. Voluptas temporibus aut aut quia qui odio vero incidunt.",Nigeria,Oyo,,"3783 Jast Ferry Apt. 849
Spencerbury, IA 72194",+1-270-841-4613,,,9,42106,72361,,,2018-05-14 11:51:44,2018-05-14 11:51:44
212,401576f24cb0415e5b2a6e5b354c2f24,veum.otilia,Roger,Prosacco,carey82@example.net,1992-09-10 19:49:02,"Dolorem aut vel ea aut quia. Ex accusamus sint id. Velit culpa accusantium consectetur omnis aspernatur recusandae quos. Sed ut ipsum atque et sapiente modi ipsa.

Vero maiores minima dolore unde molestiae. Voluptates neque consequatur eum et. Id adipisci tenetur aperiam repellendus et.",Nigeria,Ekiti,,"6896 Aurelia Forge Apt. 038
East Hector, CT 69879",(894) 971-5906,,,1,42862,66290,,,2018-05-14 11:51:44,2018-05-14 11:51:44
213,4debbac4e53d7ebe4bf8590153300ac7,lowe.lera,Emely,Dooley,mervin.hammes@example.net,1993-05-30 21:26:57,"Voluptatum nihil dolorem totam aliquam voluptatem. Officiis aspernatur harum modi dolorum possimus. Qui ut sapiente perferendis voluptatem nihil totam atque.

Praesentium recusandae culpa ut magni. Incidunt error in autem cumque facilis non. Qui ea sit quae dolor doloribus. Delectus omnis dolor in quia quae dolores.",Nigeria,Nasarawa,,"567 Conroy Roads Apt. 989
Dahliatown, OR 27684",835.602.5686 x704,,,10,46973,84985,,,2018-05-14 11:51:44,2018-05-14 11:51:44
214,a34986521044018d1c6f440bf2a791f8,kwolff,Abe,Shanahan,dtremblay@example.net,1984-05-06 00:20:53,"Iusto doloribus repudiandae ea mollitia dolorem eaque. Ut qui molestias inventore. Quia et aut ut debitis asperiores dolor.

Dolor in eos ut nulla qui fugit. Repellendus tempore repellat dolorem quidem atque sunt dolore. Esse ut et et beatae accusantium.",Nigeria,Kebbi,,"91720 Garnett Ports Suite 198
East Elianemouth, CO 99710",351-549-6216 x50125,,,9,35414,62624,,,2018-05-14 11:51:44,2018-05-14 11:51:44
215,1c9041dea1517effeee2561e2701d378,parisian.zion,Armand,Beatty,rosie70@example.org,1985-03-11 19:38:27,"Modi harum ea dolorem libero officia. Consequatur quae voluptas id voluptas ratione qui ipsum natus. Pariatur autem earum ut nostrum quo voluptates.

Eum non sapiente aut rerum. Commodi et dolores dolore. Blanditiis esse molestias amet similique nisi.",Nigeria,Kano,,"9527 Brionna Common Apt. 015
Framiport, MN 85290-4260",475-694-9511 x15024,,,9,33122,96037,,,2018-05-14 11:51:45,2018-05-14 11:51:45
216,6cf02d762e9e4843b54e14b5b4937595,bbergstrom,Betsy,Lynch,legros.jasen@example.org,1993-01-11 06:02:53,"Non debitis deleniti est et natus optio. Quasi dolorem sit amet dolorem vero distinctio sint. Est sed at autem a voluptatem esse magnam.

Non ipsam a sit id iure doloremque. Quia numquam odio quasi. Corrupti quis in iste nostrum.",Nigeria,Bayelsa,,"776 Ivory Mews Suite 754
Port Melvinaview, MO 47355-7426",+1-627-993-7294,,,6,47318,83953,,,2018-05-14 11:51:45,2018-05-14 11:51:45
217,8fe2b3b66b177814620279b8be4ed8e0,west.jeramy,Rebekah,Zulauf,emery22@example.net,1987-09-16 09:05:23,"Minus nostrum iusto rerum odio. Quia voluptates delectus quo quae eligendi praesentium. Nam exercitationem ad autem occaecati in. Nemo ut nulla aut neque aut architecto dolorum minus.

Esse sed quae et distinctio sapiente porro id. Rem iusto nam omnis blanditiis sunt.",Nigeria,Bayelsa,,"6417 Wilkinson Squares
McGlynnberg, CT 36056-1570",+1-731-346-7397,,,10,31561,65098,,,2018-05-14 11:51:45,2018-05-14 11:51:45
218,0a4fcd562a50b456e0632f09f8a5239c,krajcik.andreanne,Elouise,Feeney,chet28@example.org,1986-03-28 12:17:06,"Voluptate pariatur eligendi sequi. Eos est veniam non eum doloribus debitis reprehenderit. Officia nihil nemo qui voluptate.

Provident vel provident optio molestiae. Esse vero et consequatur. Eius dolor nostrum rem tenetur molestiae quia alias. Nobis excepturi asperiores veritatis nam officiis.",Nigeria,Borno,,"99143 Heidenreich Vista Suite 119
South Idella, AL 70608",382-320-3434 x1966,,,2,37416,57857,,,2018-05-14 11:51:45,2018-05-14 11:51:45
219,0cf1adaf73ec7309d558764a1c87e7c2,danika.treutel,Mandy,Schimmel,sadye46@example.net,1994-02-28 21:26:58,"Autem neque ut quia. Officia consectetur necessitatibus iste et dolor quam. Consequatur culpa consequatur unde modi vel facere fugiat explicabo. Voluptate non quis perspiciatis atque porro. Vitae dicta odit et dolorem assumenda tempora.

Consequuntur impedit non unde consequuntur. Harum sit nostrum impedit totam vero esse. Quia voluptatum deleniti officia porro dolor dolor.",Nigeria,Benue,,"34037 Trenton Route
Sabrynafurt, IN 64929-9067",663.745.9747,,,3,40994,62821,,,2018-05-14 11:51:45,2018-05-14 11:51:45
220,9532e0db94906cd3d6ee0f6c868e6c31,judah.hamill,Howard,Marks,marion.lemke@example.net,1983-11-13 12:44:07,"Eos nobis rerum excepturi velit. Corporis sapiente facilis qui qui. Dolorem delectus illo labore voluptatibus. Est veniam sequi omnis saepe. Ut quis consequatur quidem.

Eveniet et sed dolores velit inventore fugit quaerat. Sint quod officiis et inventore maiores. Ut inventore quos sed at aut dolores. Vel occaecati quia vel sequi.",Nigeria,Ondo,,"4477 Gerlach Circles
New Dontown, HI 29452-4179",+14385864695,,,7,39177,88814,,,2018-05-14 11:51:45,2018-05-14 11:51:45
221,32dfede1bd9eb2bc35c51b7ad74f56d7,mireya.stiedemann,Herminio,Leuschke,heathcote.ramona@example.com,1992-10-19 16:02:46,"Quae autem nisi facilis est nulla. Dicta iusto occaecati ipsam perferendis. Rerum repellat qui quisquam nemo nam. Suscipit non itaque illum numquam qui.

Nesciunt saepe perspiciatis culpa sit natus omnis iste natus. Optio dolor est adipisci illum vitae et. Voluptatum consequuntur voluptas ab placeat beatae doloribus exercitationem. Quaerat velit ullam tempora voluptatem repellat veniam.",Nigeria,Borno,,"8888 Reichert Crescent Apt. 481
Port Nathanielborough, KS 60343-6859",1-491-802-4656 x6201,,,6,30189,75285,,,2018-05-14 11:51:46,2018-05-14 11:51:46
222,430f8a7213c6dc7000a8b83e3b60c5fe,xhuel,Marianna,Morissette,vstamm@example.com,1993-02-06 18:11:40,"Culpa earum harum aliquam mollitia sed a error nostrum. Rerum iste commodi ut sint aspernatur necessitatibus delectus repudiandae. Et explicabo maiores perspiciatis sequi nihil odio.

Sunt aliquid omnis quae itaque soluta repudiandae. Repudiandae explicabo eos voluptas quam. Consequatur adipisci ab sit sit. Minus est quia enim possimus quod qui voluptatum sint.",Nigeria,Imo,,"52448 Leonel Common
East Hannah, AK 02897",204-215-0755,,,6,45754,93918,,,2018-05-14 11:51:46,2018-05-14 11:51:46
223,3a3d6b648e0120c36f49c20d15c7068c,margarete.jaskolski,Liana,Spencer,llehner@example.com,1983-12-03 09:56:44,"Sit dolores facilis soluta pariatur saepe. Quasi voluptatem minus omnis qui. Veniam corporis laudantium sunt quia.

Voluptatem expedita quia facere dolorem. Sunt doloribus aspernatur est voluptatibus illum esse aut. Error at maxime nemo neque numquam nulla veniam. Illo autem voluptate cum. Deleniti reiciendis voluptatibus et reprehenderit sed.",Nigeria,Oyo,,"98580 Kevin Vista Apt. 927
Lake Emory, OH 27972",(589) 215-3827 x09768,,,6,34783,89865,,,2018-05-14 11:51:46,2018-05-14 11:51:46
224,cf080ba2dfeb7f9258c9ac99574b9ea2,lura64,Kaley,Schumm,angeline72@example.net,1998-04-14 00:00:22,"Magnam placeat velit eius explicabo tempore odit nihil. Facilis illo blanditiis sint architecto. Nemo aut occaecati ea non iure magnam.

Aperiam unde quod eos qui dolor quis. Placeat nostrum et quia dolores vitae ut voluptas. Corporis reprehenderit ea odio voluptatem sed quam dolores incidunt.",Nigeria,Benue,,"486 Parker Knolls
Batzland, ND 21066-2542",(828) 746-6480 x042,,,2,36807,83530,,,2018-05-14 11:51:46,2018-05-14 11:51:46
225,d7f7c9eef602e31683a8c4d71ff07654,kspencer,Wilton,Hahn,patricia76@example.com,1989-01-26 00:11:50,"Non libero omnis eum quia quis id velit. Aperiam eos beatae et enim qui odio ea unde. Rem explicabo qui odit error. Et illum ab quis iure in veritatis.

Exercitationem aut nihil id repudiandae atque dignissimos. Dignissimos voluptates et non corrupti voluptas vel iste.",Nigeria,Edo,,"83953 Gabriella Junctions
West Rhoda, ID 24740-6413",312.615.5142,,,9,45718,91927,,,2018-05-14 11:51:46,2018-05-14 11:51:46
226,effb5297fb605b36a0ba95b528623c9d,josephine75,Gilda,Goodwin,rudy05@example.net,1995-03-28 12:08:34,"Nihil facilis provident eligendi. Aperiam eum beatae consectetur modi. Fugiat veniam deleniti non ut repellendus tempora quos et. Et nisi beatae reprehenderit et.

Totam nihil atque laboriosam quod. Vel reprehenderit omnis magnam explicabo incidunt laborum rerum. Placeat et sunt quas cumque qui hic.",Nigeria,Borno,,"8248 Aditya Landing
Auroreland, FL 95490-4930",1-683-753-1074,,,6,41015,71842,,,2018-05-14 11:51:47,2018-05-14 11:51:47
227,7de2ead4e61340cb74f778c85b4c98c7,ettie.kassulke,Cassie,Padberg,johnson.brian@example.org,1995-12-11 06:05:54,"Eum enim culpa ex voluptas consequatur natus. Minus sint explicabo iusto voluptates dolores ab. Porro quis maiores autem. Sed cum numquam reiciendis illum.

Molestiae consequatur nostrum sed. Consequatur nesciunt non illo quia non. Inventore itaque fuga est ipsum esse asperiores. Vero consequatur necessitatibus est consectetur.",Nigeria,Adamawa,,"9548 Marianna Ways
West Laurianne, TX 62072-6091",1-373-299-1881,,,10,34113,95090,,,2018-05-14 11:51:47,2018-05-14 11:51:47
228,4c9362b81d8ce6a7762240ccbd031195,myrtis22,Darrick,Tillman,maia55@example.com,1993-03-25 09:51:11,"Porro distinctio dolores id sed. Facilis consequatur ducimus explicabo recusandae. Sint nostrum veritatis architecto quo nobis nulla.

Provident voluptas aut dolorem velit dolorem. Dicta ad corporis unde molestiae consequatur. Voluptates est molestiae dolorem sed eaque in facere.",Nigeria,Kaduna,,"7110 Filiberto Orchard Suite 522
Daneburgh, AK 77905-3228",318-721-1283,,,6,45099,58813,,,2018-05-14 11:51:47,2018-05-14 11:51:47
