229,edd8de25c1f72a9b0425fb9dcfeefe91,meagan.witting,Addison,Maggio,henri.mraz@example.net,1988-11-12 08:39:37,"Qui beatae aut beatae. Dolores molestias velit a ut harum et. Sed laborum rem aut sed fuga. Ipsum amet corrupti vel.

Modi adipisci aspernatur voluptates qui libero eum et. Necessitatibus dignissimos rerum natus saepe voluptatum sed tempora dolores. Voluptatem porro accusantium asperiores nemo occaecati unde rerum.",Nigeria,Taraba,,"1497 Mark Turnpike Suite 912
Fernandoborough, IA 20189",501.808.2535 x43136,,,6,34291,60236,,,2018-05-14 11:51:47,2018-05-14 11:51:47
230,4036655fdeb6c7a49b516163e74c0dc9,metz.margret,Norene,Kub,monroe17@example.org,1990-11-14 01:43:23,"Fugiat iste aut impedit iste. Est et nihil atque harum dolore omnis quia accusamus. Culpa sit molestiae natus voluptatum voluptatem asperiores dolor. Deleniti inventore minima aperiam esse.

Et sed est ut doloribus in est. Optio explicabo et ex molestiae. Sint inventore inventore rem minus nostrum magni.",Nigeria,Kwara,,"669 Kerluke Square
Greenfelderburgh, ID 67167",(858) 497-5051,,,10,40396,96633,,,2018-05-14 11:51:47,2018-05-14 11:51:47
231,83010ea507bcf08db374e6173774c89d,mikel64,Rosalinda,Lakin,evert46@example.org,1985-02-15 10:58:34,"Est quidem molestias eos ut. Quaerat consequatur qui distinctio accusamus. Totam aut consectetur voluptas.

Qui esse excepturi consequatur quasi. Veritatis explicabo est expedita modi et est.",Nigeria,Cross River,,"7882 Schaden Spring
Malcolmville, WI 20711-4587",+1 (245) 564-1461,,,10,41425,61512,,,2018-05-14 11:51:47,2018-05-14 11:51:47
232,0d9ff0e51f1c98c9cc23c6e142a5fbb1,osawayn,Lauriane,Keeling,heaven60@example.com,1984-07-22 21:32:32,"Dolorem alias necessitatibus quos ut quia dolores ut. Ipsam delectus perspiciatis doloremque magni et et et.

Ipsum saepe tempora a amet atque id amet ipsum. Necessitatibus ut sunt sint officia est. Temporibus non reprehenderit earum enim. Odit eveniet aut dolore.",Nigeria,Nasarawa,,"9842 Prosacco Gateway
North Briabury, DC 52785-2934",574-490-8660,,,8,31473,69260,,,2018-05-14 11:51:48,2018-05-14 11:51:48
233,42707ef0a205caf9a186fadbc1e3701a,lakin.geoffrey,Bettye,Homenick,kuhlman.clifton@example.net,1991-07-10 12:40:34,"Veritatis nesciunt ratione repellat illo hic explicabo illo. Quis quis quia ab veritatis veniam qui. Possimus ut qui doloribus. Hic quo nesciunt explicabo id eaque.

Dolorem dolorem nam magni impedit. Voluptatum consectetur sequi eos in. Ab aut rem sed deleniti omnis. Molestias sed voluptas magni et quia. Blanditiis optio culpa harum.",Nigeria,Cross River,,"456 Howell Plains Apt. 691
Kreigerhaven, MN 31428",+1.882.955.7961,,,2,44381,76273,,,2018-05-14 11:51:48,2018-05-14 11:51:48
234,53cea86f3358815fdf4b2035db65c66f,hbecker,Travis,Murray,benny67@example.com,1996-12-02 12:11:58,"Sunt voluptate ullam voluptatem unde labore quae est eum. Cum velit et neque quae et. Nemo quia minima ea deserunt autem non temporibus vitae.

Nulla ea qui nulla accusantium. Velit explicabo eaque omnis cumque voluptas et voluptates impedit. Tempore veritatis velit officia sed aut provident et.",Nigeria,Taraba,,"332 Marshall Orchard
Harveytown, MO 51515",1-869-356-6125 x313,,,9,43935,85265,,,2018-05-14 11:51:48,2018-05-14 11:51:48
235,927487f29487c939970619b88993be0a,qhessel,Fred,Kuphal,trycia43@example.net,1988-02-21 21:00:29,"Veritatis et doloribus distinctio aut fugit. Assumenda consequatur perferendis sit autem doloribus temporibus accusantium. Aut est laudantium laborum iure soluta. Rerum voluptatum aliquam itaque et consequatur.

Quia quo sequi at excepturi sed. Aut sapiente laborum est aut non nesciunt. Dolorem rem est aliquam omnis quibusdam molestiae maxime quod. Sed fuga sint accusamus possimus dolor corrupti autem qui.",Nigeria,Plateau,,"8390 Franecki Inlet
Lake Brentstad, TX 25995-8257",+1 (445) 545-0140,,,10,42179,66074,,,2018-05-14 11:51:48,2018-05-14 11:51:48
236,700f42f8545a56ede2a7b03b5e1d6cf8,marvin24,Bettie,Lakin,nlehner@example.com,1987-08-04 02:08:16,"Non quidem culpa eligendi fugiat sequi praesentium sunt. Suscipit sed reprehenderit veritatis quis sint rerum ut natus. In tempore ut et provident consequatur corporis.

Sint consequatur sed ea dolore dolores voluptatum. Distinctio aliquam odio rerum enim voluptatem nisi voluptatibus. Doloremque voluptates amet magni quasi est voluptas. Corrupti sunt veritatis et optio in labore rerum aspernatur.",Nigeria,Kwara,,"25876 Marlee Wall Apt. 224
South Maevemouth, IA 70156-2716",586.791.3260,,,6,41509,62020,,,2018-05-14 11:51:48,2018-05-14 11:51:48
237,639a7560bb3d5a6f9b56d66f1c85ac19,ellen.hane,Kobe,Sporer,gmuller@example.net,1984-07-28 16:19:23,"Voluptatem eligendi quam est molestias vel. Suscipit repellendus iure autem temporibus. Culpa quo blanditiis soluta aliquid quia. Autem non quia laborum pariatur omnis voluptatibus veniam ipsum.

Nam dolorem velit laudantium dolores temporibus ipsum. Qui iste omnis et omnis magnam. Ut ut incidunt voluptas omnis distinctio deserunt inventore.",Nigeria,Bayelsa,,"9062 Justine Fall
East Felton, MD 36237",665-203-2702,,,6,36058,81011,,,2018-05-14 11:51:48,2018-05-14 11:51:48
238,6eca86c13f24ce45d13de94bf9f5518d,uwolff,Shaina,Bartoletti,shaina05@example.net,1983-06-19 01:25:35,"Commodi laudantium dolorum ut dicta cupiditate porro. Saepe natus iste molestiae totam. Hic dolorum dolorum nesciunt eveniet et eveniet et.

Omnis distinctio quo voluptate asperiores tempora consectetur nostrum laborum. Non omnis aut et reiciendis non culpa qui. Ratione consequuntur laboriosam mollitia enim quasi. Et placeat earum aperiam ipsam eius repellat.",Nigeria,Katsina,,"7298 Ankunding Orchard Apt. 874
Lake Evertborough, MT 22792",653.936.5159,,,10,47479,68828,,,2018-05-14 11:51:49,2018-05-14 11:51:49
239,b4dc881e858ac7566657f5e96dc5809c,price.nels,Meghan,Sporer,hschultz@example.com,1986-09-18 03:26:45,"Consequuntur impedit repellat maiores. A rerum dolorem at non officiis.

Repellendus possimus voluptas ut atque exercitationem qui ut. Aliquid dolorem autem excepturi occaecati. Nobis quos eum autem corporis. Porro explicabo est illum est.",Nigeria,Niger,,"2731 Yundt Groves
West Antonietta, NY 12698-1783",(891) 550-8424,,,1,41894,65658,,,2018-05-14 11:51:49,2018-05-14 11:51:49
240,4591f7fa4189d2bf65fd9f67128f98f8,dortha96,Monica,O'Hara,hkutch@example.org,1991-10-12 18:33:09,"Sed beatae sint vel sed vero quidem. Tempora quae dolores mollitia quia nobis. Et debitis autem voluptas ut enim est nesciunt eum.

Est sed eligendi vel non nulla et et. Non itaque vel aut. Cupiditate magni esse quia sit et fuga et.",Nigeria,Sokoto,,"966 Lourdes Parkways
Corwinburgh, HI 87476-9750",931.463.7693,,,1,32505,63289,,,2018-05-14 11:51:49,2018-05-14 11:51:49
241,98159d4e850f72f8a00fe5c06ccc0772,nathan10,Abe,Dietrich,murazik.junius@example.net,1990-03-25 18:51:15,"Id iure incidunt adipisci qui. Tenetur ut voluptates inventore adipisci. Ipsam possimus hic cupiditate et et iusto. Quis iure voluptas vel qui.

Sed est quibusdam dolores vel nostrum. Eos porro voluptatem molestiae dolores expedita exercitationem reiciendis modi. Voluptas exercitationem et aliquam corrupti et recusandae eum.",Nigeria,Katsina,,"492 Vernon Stream Apt. 067
West Austen, NV 14516",625-301-7941 x53402,,,8,41853,89062,,,2018-05-14 11:51:49,2018-05-14 11:51:49
242,d8b9f3b9ff7a768ddca9c374c5a4ea74,padberg.pierce,Tia,O'Connell,witting.deangelo@example.net,1987-06-19 17:55:14,"Distinctio vitae quae id doloremque deleniti sit. Iure ut qui qui quasi. Autem occaecati similique quidem asperiores totam rerum magni.

Assumenda libero odio accusantium occaecati minima. Et corporis ipsam cumque reiciendis officia illo. Ea culpa dolores ipsa sunt. Ut cumque pariatur officiis.",Nigeria,Bayelsa,,"8264 Angela Square
South Davonteport, WV 27676",+1-368-260-7916,,,9,32602,65155,,,2018-05-14 11:51:49,2018-05-14 11:51:49
243,fd8aa5177c0a177ad89001dd8b205777,xgottlieb,Faustino,Wolff,tcollins@example.net,1993-12-04 13:50:22,"Voluptates corrupti aut in deserunt nesciunt quod dignissimos sint. Omnis ducimus optio reiciendis et.

Sit aliquam omnis asperiores cum cumque. Nesciunt nihil at facere. Et sit omnis voluptatem aliquid nesciunt aut. Laboriosam hic cupiditate saepe.",Nigeria,Niger,,"6172 Jakubowski Estate
Dachton, WY 72639",634-362-3588 x246,,,7,35666,91666,,,2018-05-14 11:51:49,2018-05-14 11:51:49
244,c69fa3703fa41bcbba368dda3030498d,hudson.greenholt,Dagmar,Schoen,heaney.esteban@example.org,1984-08-16 13:01:16,"Nam debitis excepturi sit dolorum. Sit laborum sed aut autem minus animi. Sed cum earum et voluptatem.

Sunt inventore reiciendis est. Officiis rerum rerum repellat. Eveniet non nihil impedit iste sequi eius. Optio harum eaque placeat enim.",Nigeria,Delta,,"90156 Willms Rue
Hillltown, MN 40523",(589) 596-5123 x000,,,10,47248,99254,,,2018-05-14 11:51:50,2018-05-14 11:51:50
245,4c482ad5b6a6182f0e986125a365810b,abbott.bertrand,Bethany,Sipes,hyatt.lucinda@example.com,1990-07-16 04:42:38,"Exercitationem aspernatur voluptas consequatur. Quam et fuga aspernatur dolorem quia ratione voluptatum iure.

Inventore enim rerum pariatur impedit omnis sint omnis eveniet. Porro non aperiam voluptas. Asperiores voluptas autem doloremque dolor cupiditate voluptatum.",Nigeria,Kwara,,"39556 Bianka Club
Loweton, WV 57054-3238",1-798-382-6047 x46852,,,0,38046,62768,,,2018-05-14 11:51:50,2018-05-14 11:51:50
246,f6b755cab0be0f989c578ebc4a6d457a,eichmann.pansy,Kellie,Schuster,dietrich.adeline@example.net,1996-05-21 02:17:35,"Similique quia ipsam perferendis voluptatem voluptas veniam. Sunt voluptatem mollitia asperiores vel.

Ut exercitationem quia eligendi quaerat eveniet cumque et. Necessitatibus eveniet ut quidem omnis omnis totam.",Nigeria,Kogi,,"6362 Swift Harbors Apt. 390
Lake Pierreville, AZ 96810",280-633-5403 x62764,,,1,42801,98048,,,2018-05-14 11:51:50,2018-05-14 11:51:50
247,8a5ad86764a2bfeb69984b3991534fc1,marjory.pollich,Chelsea,Welch,ohara.hipolito@example.net,1988-05-22 10:46:09,"Voluptas et sit minus quisquam recusandae. Molestias voluptatem veniam blanditiis autem inventore. Beatae odit enim eaque sit.

In in blanditiis rem facere sequi. Enim saepe accusamus et porro libero corporis et ipsum. Facere blanditiis eveniet explicabo saepe quod. Maiores fuga quod ut distinctio harum animi.",Nigeria,Akwa Ibom,,"53354 Heaney Throughway Apt. 376
Haagfort, IN 93852-3373",1-603-971-2982,,,1,38312,74955,,,2018-05-14 11:51:50,2018-05-14 11:51:50
248,b664da27984541e572d9f6d56768fd11,johathan47,Rubie,Feil,kbotsford@example.org,1996-03-20 12:15:48,"Facere culpa rem consequuntur ut dolorum. Sapiente sint iusto mollitia quidem nesciunt. Est exercitationem et eius enim aut inventore sed officia.

Sit quasi corrupti sit recusandae. Sapiente cupiditate in rerum. Est et maxime sit blanditiis.",Nigeria,Edo,,"6099 Lakin Squares Apt. 039
Drakeview, TX 35645-8394",751.536.5955,,,2,39919,73322,,,2018-05-14 11:51:50,2018-05-14 11:51:50
249,a30be39055f6275d2405d1ca7a460100,douglas66,Paula,Huel,dtowne@example.net,1987-05-21 10:24:02,"Labore sunt ipsum quibusdam velit aut. Consequatur dolor nobis eius reprehenderit non. Placeat porro modi vel numquam voluptatem.

Esse ut enim architecto adipisci consequatur. Enim mollitia laboriosam maxime. Nemo vero aut eos culpa at vel illum. Soluta est reprehenderit quidem error.",Nigeria,Osun,,"518 O'Keefe Views Suite 677
West Abrahammouth, ID 65429-1876",1-397-356-7853 x3774,,,10,43240,62461,,,2018-05-14 11:51:51,2018-05-14 11:51:51
250,4b6ab751ccb9de64fda233f7c7187fbc,ccrona,Josiah,Schaefer,melisa.stark@example.com,1996-02-18 09:36:28,"Eius quidem nostrum qui cumque cupiditate aperiam. Suscipit earum eum voluptatibus eum. Qui ea quisquam aliquam delectus. Veritatis ab commodi error voluptatem consequatur. Non vitae qui perferendis quis.

Repellendus optio voluptas et incidunt iure. Eligendi sunt libero nam exercitationem repudiandae. Voluptatem non id est aut eos consequuntur id. Ipsa aliquam sequi nisi tempore rerum dolor ex.",Nigeria,Kwara,,"395 Schmeler Green
Murrayhaven, NV 96816-4002",+1 (578) 352-3602,,,0,39313,60093,,,2018-05-14 11:51:51,2018-05-14 11:51:51
251,73db088307f924ea4a4ab0d74f2c808b,adach,Arnulfo,Larkin,vonrueden.verlie@example.org,1998-03-27 18:01:51,"Sapiente enim vero placeat quasi iure. Aliquid nihil id non autem. Voluptas aliquid ea eum ut molestias dolor cum. Excepturi molestiae omnis quo soluta.

Reprehenderit et odio voluptates repellendus. Fuga dolore dolores itaque nesciunt. Qui voluptatibus soluta animi et nihil iste. Pariatur aperiam id quod asperiores.",Nigeria,Sokoto,,"73285 Jefferey Courts Apt. 796
New Alvastad, CO 78130-7890",890-766-8059 x1118,,,1,48635,94718,,,2018-05-14 11:51:51,2018-05-14 11:51:51
252,cc891ebb1df56511b39cc16066a1075e,gaston.walsh,Geoffrey,Welch,lang.jordyn@example.net,1988-04-13 16:05:54,"Animi voluptates et omnis velit dolor consequuntur sunt. Aut natus aut ut. Laborum dolorem hic exercitationem quia quasi et quo.

Repellat ex ea neque. Modi doloremque ratione ea delectus blanditiis iusto repellendus aliquam. Possimus tempore sit aut ut aut dolorem eos.",Nigeria,Kwara,,"24806 Ernser Canyon
West Maurinehaven, NH 28556",395-403-8494 x911,,,10,34697,74481,,,2018-05-14 11:51:51,2018-05-14 11:51:51
253,f71e0e291404405257a27884989cb974,earline84,Clifford,Reichel,katelin.mosciski@example.org,1985-11-14 15:51:29,"Qui animi tempore neque temporibus exercitationem totam magnam. Dolorum repellat dolor commodi. Nihil ex qui eos quaerat. Dignissimos voluptatibus ut sunt voluptas a accusantium.

Voluptatem dolores qui praesentium ipsum. Non aspernatur eum molestiae.",Nigeria,Oyo,,"899 Buckridge Plaza Suite 195
Jaidamouth, NH 43761-8420",+1-486-330-2606,,,2,32434,75181,,,2018-05-14 11:51:51,2018-05-14 11:51:51
254,29be5b2e2687cd53610cd5e9dfe55a50,adickens,Gerhard,Goodwin,lmurazik@example.net,1985-09-19 05:45:38,"Vitae reprehenderit voluptates ut. Explicabo provident impedit quibusdam. Voluptas ut est qui incidunt.

Quidem soluta dolore esse deserunt. Fugiat magnam nisi et veritatis veritatis eos. Architecto omnis consequatur fugiat nam nobis distinctio omnis. Saepe voluptas adipisci odio modi molestias voluptas. Corporis voluptas exercitationem ut eum.",Nigeria,Kogi,,"98406 Jacobson Centers Apt. 944
South Winston, TN 24682-5179",681.916.0353 x4670,,,7,39918,77841,,,2018-05-14 11:51:51,2018-05-14 11:51:51
255,205ef921dde481137352aa5a6a43efa0,vicenta67,Marcus,Murphy,john.robel@example.com,1995-07-17 15:33:05,"Minus occaecati ex nihil rerum. Veniam non similique voluptatem velit sed ipsa eius. Quam et ea asperiores sint occaecati maiores nulla et.

Ut non sunt voluptatum facere enim amet provident. Maiores quidem id omnis quis. Quae sunt aut fuga et autem asperiores consectetur est. Quibusdam officia maiores unde odio ut est qui nihil.",Nigeria,Bayelsa,,"667 O'Conner Mill
Hazeltown, RI 90823-9946",+1-751-618-0223,,,1,41954,96399,,,2018-05-14 11:51:52,2018-05-14 11:51:52
256,04476a49a2355761a264912f10f9f5f4,velda74,Albertha,McClure,crist.tyrell@example.org,1987-08-06 20:28:19,"Consequatur et architecto asperiores quos porro reiciendis. Omnis autem asperiores fugiat error nisi accusamus perferendis. Sed consequuntur dolorem veritatis qui eum. Reiciendis officiis ipsum veniam.

Ullam sed ex pariatur. Ullam eius rerum et alias nihil rerum similique aut. Doloribus repellat id non quae temporibus adipisci in.",Nigeria,Ebonyi,,"8576 Mueller Alley
North Montymouth, AK 86645-7377",1-572-263-9596 x369,,,10,48014,86662,,,2018-05-14 11:51:52,2018-05-14 11:51:52
257,3cd6b649ce8c1eaf170068ddd2286298,audrey16,Jed,Wiegand,arturo.reinger@example.org,1984-07-07 15:14:23,"Eum dolores aut eaque aspernatur laboriosam autem. Vel est iusto sequi.

Et unde provident exercitationem nesciunt enim amet. Nobis fuga rerum corporis numquam. Veritatis sit excepturi corporis rerum.",Nigeria,Kogi,,"79174 Oma Throughway
Robelville, LA 04181-3717",(539) 578-1728 x74340,,,3,35391,65490,,,2018-05-14 11:51:52,2018-05-14 11:51:52
258,f30d647767c9146e4a859315233b1c6b,khalil.okon,Dortha,Nitzsche,qmayert@example.net,1996-04-01 22:27:53,"Quos culpa non eum quos est. Repellat ut architecto totam recusandae enim. Perferendis quis ipsa quas molestiae voluptatem eveniet itaque. Vel facere officiis delectus veniam. Autem non quam aut rerum commodi et a.

Debitis sapiente voluptatem perspiciatis consequatur iusto soluta. Ut earum reiciendis fugit quo neque rerum nisi. Dignissimos optio et doloremque porro quo non. Voluptatem nostrum recusandae sunt delectus deserunt.",Nigeria,Nasarawa,,"48649 Hickle Lake
Port Nolanmouth, VT 40570",(738) 396-1369 x305,,,3,36128,69726,,,2018-05-14 11:51:52,2018-05-14 11:51:52
259,e167697f3989e13bfb2c5c39bda17c5d,bo73,Everett,Stehr,abeer@example.com,1990-05-07 04:23:40,"Tempore labore facere recusandae dolorem. Expedita esse occaecati rem sit quia incidunt hic. Aut totam aut sunt ex quia rem nostrum consectetur.

Sunt est similique dolorum asperiores. Cum consequatur molestias accusamus nobis voluptate ipsa quia. Amet est et fuga maxime corporis reprehenderit illum nisi. Quidem tempore ex error rem.",Nigeria,Nasarawa,,"72338 Isabella Crest
Port Malindafort, VA 02786-5172",410.729.4881 x027,,,8,39223,68012,,,2018-05-14 11:51:52,2018-05-14 11:51:52
260,b58d3091227e8550b2236721b1ca01be,xturcotte,Santos,Legros,guy.leuschke@example.net,1983-06-16 05:27:24,"Consequatur suscipit placeat accusamus officia omnis ipsa illo eveniet. Minus voluptatem dolor et quis sapiente quidem. Magni mollitia pariatur nihil consequatur. Autem qui rerum porro totam quis ullam consequatur.

Eum doloremque quis rerum id voluptatem aut quibusdam numquam. Sit quae velit error sit aut. Expedita dolor doloribus eos.",Nigeria,Kaduna,,"2775 Dickens Villages Suite 323
Herminioton, DE 25363-6403",(375) 462-3439,,,4,45512,87769,,,2018-05-14 11:51:52,2018-05-14 11:51:52
261,1a91c96abb248bbb8f0de4e4ed4106f6,eloisa.gislason,Felipe,Rau,april.watsica@example.net,1992-08-15 21:40:15,"Eaque repudiandae quod fuga sint. Neque ipsa quas velit quod placeat et. Velit quidem minus et est odio asperiores non ipsum.

Possimus earum optio reiciendis doloribus aliquam sit. Ex placeat aut inventore est aperiam. Nihil est consequatur quidem cupiditate laboriosam possimus magnam aut. In vitae numquam mollitia explicabo nemo nostrum repellat.",Nigeria,Plateau,,"61921 Lindgren Rest
New Josefort, NH 84656-5571",386-459-4980,,,5,48951,54848,,,2018-05-14 11:51:53,2018-05-14 11:51:53
262,6134619b5399dd7c35df4bedb1bb18fe,nelle54,Rigoberto,Witting,ahauck@example.net,1988-01-17 15:03:30,"Cupiditate non sunt excepturi. Omnis adipisci rerum ea exercitationem sed. Minima iusto quae ducimus aut provident autem non.

Consequatur est cupiditate laudantium dolorem quaerat. Doloribus quia nam quia neque. Ut mollitia tempora qui et distinctio natus voluptas. Non non assumenda est voluptas vel. Commodi iste cumque esse ratione tempora.",Nigeria,Sokoto,,"481 Eldora Ford Apt. 393
New Katelynshire, MS 56782-6846",1-715-624-6214,,,5,43464,77988,,,2018-05-14 11:51:53,2018-05-14 11:51:53
263,b8cb12176517be934f78d91001540d66,trantow.ena,Cesar,Watsica,lila48@example.com,1985-08-11 02:32:00,"Et ratione quam nihil ipsam quo. In nisi est aliquam veritatis nemo. Quasi iure consequatur doloribus et facere. Similique blanditiis quidem qui commodi cupiditate facilis.

Quis est aut asperiores error aliquam. Nulla eum vel aut praesentium iure. Quia quasi quos aliquam veniam. Recusandae voluptatem nesciunt aliquam ut. Laboriosam deserunt ut ex quis molestias qui qui.",Nigeria,Oyo,,"13001 Rylee Skyway
Geoffreymouth, UT 90592",+1-342-645-0989,,,10,43909,53043,,,2018-05-14 11:51:53,2018-05-14 11:51:53
264,9b24a1f960bbedc7d27946b5a3dadef7,arianna.weissnat,Guiseppe,Legros,blaze.schmeler@example.com,1994-02-25 07:08:19,"At accusamus qui laboriosam dolores. Modi minima delectus et modi eius. Ut autem velit impedit et autem voluptas magni mollitia.

Ab pariatur sint consequuntur. Est quia ut quam quia fugit aut. Ullam non sunt qui voluptatibus alias et. Libero sapiente iure quod omnis.",Nigeria,Edo,,"107 Corkery Streets Suite 795
Port Tad, AZ 45726",1-374-973-6630 x43886,,,7,35359,64451,,,2018-05-14 11:51:53,2018-05-14 11:51:53
265,be02d1fa972e139865d75abf0d25f947,corine96,Brady,Ward,angelina61@example.com,1995-05-02 10:10:00,"Sit nemo laudantium beatae dicta blanditiis neque accusamus nostrum. Pariatur voluptates iusto asperiores et qui quo. Non nobis iusto suscipit porro dolore nobis reprehenderit fugiat. Velit est aperiam sint quaerat vero fugit.

Ducimus dolorem accusantium voluptatem explicabo maiores aspernatur incidunt quisquam. Aut itaque omnis qui voluptatum aliquid adipisci consequatur. Ullam ipsam dolores cumque minus nobis. Quibusdam necessitatibus quasi deserunt esse earum ad omnis. Excepturi rerum occaecati excepturi debitis consequatur repellendus porro aspernatur.",Nigeria,Kebbi,,"612 Marcelino Street Apt. 950
Betsymouth, DC 99436-6353",582-831-1770 x22095,,,7,32189,73379,,,2018-05-14 11:51:53,2018-05-14 11:51:53
266,fb69bcd0bbe82e8dc2068d5aff6e0923,rogahn.paxton,Kristin,Turcotte,ned.bogan@example.net,1996-03-13 12:13:28,"Optio placeat qui ut maiores. Laboriosam voluptatem dolor neque qui recusandae. Tenetur inventore voluptas eaque quidem at. Ut molestiae et eveniet odio.

Dolor vel labore eum voluptatem saepe alias aspernatur. Eos dicta cum sed tempore repellat velit impedit. Error qui reiciendis a minus rerum aut culpa. Ex eos quae id voluptatem iste.",Nigeria,Bayelsa,,"3174 Salma Pass Apt. 400
Port Jon, MD 93537-9912",1-694-893-9632 x57491,,,10,32273,82558,,,2018-05-14 11:51:53,2018-05-14 11:51:53
267,bec49a564d5a24c07979d81f2a7082ee,mills.hosea,Sabryna,Howe,quigley.freddie@example.net,1990-07-06 04:28:57,"Magni debitis in et qui libero impedit quam. Dolor quae eveniet minima numquam beatae. Vitae aut nam doloremque hic omnis. Earum cum et et neque suscipit iusto repellendus. Beatae ut sunt quidem dolore sit quisquam.

Error quia dolores qui veniam est. Ea est adipisci et saepe.",Nigeria,Kaduna,,"6973 Brando Crossing
Mandytown, CO 49300",+1 (885) 683-9770,,,0,44367,91506,,,2018-05-14 11:51:54,2018-05-14 11:51:54
268,56923b63e52b10fd7ab2a7ea8434c213,bonnie24,Gaetano,Turcotte,stoltenberg.moises@example.net,1991-11-03 05:59:48,"Sit sint quae et doloribus eum. Repellendus qui et velit ab autem ea voluptatum. Laborum quidem temporibus sit assumenda veritatis illum blanditiis.

Odit est et magnam voluptate et. Quia nihil nihil sunt dolorem totam quod ea provident. Aut eius dolorem facere officia blanditiis.",Nigeria,Adamawa,,"891 Rempel Ferry Suite 498
Cartwrightshire, UT 59736",862-540-0806,,,7,39448,72405,,,2018-05-14 11:51:54,2018-05-14 11:51:54
269,16e931a4f585bcf8a445183db6ed5325,omari06,Kenneth,Kuhn,kellie23@example.org,1988-04-08 01:12:09,"Distinctio minima et eos voluptatem dignissimos est et culpa. Odio possimus labore amet omnis cum ab laudantium. Culpa id voluptates ut.

Omnis sunt quasi omnis vel. Consequatur est perferendis modi asperiores consequatur. Rem nostrum nulla vero ducimus omnis.",Nigeria,Edo,,"5547 Stracke Way Suite 365
Lake Elisabeth, IA 97673",403-813-2537 x50169,,,10,47898,55006,,,2018-05-14 11:51:54,2018-05-14 11:51:54
270,d2e7419c6204621b41e7314bb8f59be4,boyer.saige,Ashton,Gibson,legros.zakary@example.org,1984-12-30 06:18:57,"Velit aspernatur ullam qui non necessitatibus dolores. Vel earum dolor qui repellat eveniet animi. Harum repellat nostrum est dolorum dicta quia voluptatibus.

Esse ut labore aspernatur aut qui. Dolor sint in provident ullam delectus blanditiis rem. Voluptatem ut omnis hic sunt repudiandae eos adipisci.",Nigeria,Sokoto,,"6728 McClure Lake
Port Nellamouth, FL 08257",805-656-7451,,,6,41755,50580,,,2018-05-14 11:51:54,2018-05-14 11:51:54
271,5cfdc176da230818583573ce726e970c,lbailey,Leann,Bogan,steuber.mittie@example.com,1990-05-29 02:29:36,"Voluptatibus expedita nobis est facere tempore quia est. Recusandae ab non nostrum ipsum. Natus ratione impedit aut voluptas quibusdam sed.

Optio porro qui quidem voluptate facere aspernatur fugiat. Exercitationem delectus laborum temporibus consequatur quisquam aliquam in. Non enim eos qui officia sed. Odit qui eius culpa magni similique est.",Nigeria,Bayelsa,,"3525 Runolfsdottir Valley Suite 162
Thomasfort, FL 06510",359.708.4073,,,3,32456,71527,,,2018-05-14 11:51:54,2018-05-14 11:51:54
272,7e539aba23068f4eb88b03af48db2678,cborer,Chet,Kuhic,ratke.kane@example.org,1997-03-11 15:32:44,"Asperiores fugit vel consequatur dolorum tenetur debitis inventore. Consequuntur facere nostrum eaque exercitationem veniam omnis cumque. Numquam ea eligendi et.

Qui aperiam mollitia est consequuntur. Cum sed tenetur et exercitationem. At id ullam alias blanditiis eius corporis necessitatibus. Reprehenderit dolor recusandae ut porro quia.",Nigeria,Kogi,,"73389 Laurine Rapid Suite 601
Leannontown, HI 86423",424.790.9446,,,7,43514,71938,,,2018-05-14 11:51:55,2018-05-14 11:51:55
273,a0f54098d2d57cca56eac4abc7118f5c,jackeline54,Lisandro,Macejkovic,dylan04@example.com,1987-10-19 23:35:01,"Consequatur debitis dolorum dolore amet eos ipsam placeat. Occaecati odit eos ipsa minima asperiores. Aut aliquid eum quae et molestiae commodi autem.

Aut deleniti consequatur blanditiis aut nisi ad. Labore repellat aliquid molestiae alias et maxime at. Enim quos fuga alias eius doloremque quia.",Nigeria,Edo,,"1124 Walsh Shoal Suite 014
Port Kaylafort, ND 24715-3394",458.729.6329 x78373,,,8,36214,98376,,,2018-05-14 11:51:55,2018-05-14 11:51:55
274,05489a0fe155138c9ba38aeb51a73ea0,stroman.josiah,Colby,Farrell,zulauf.lavinia@example.org,1989-08-19 19:07:43,"Sit reprehenderit libero iure sunt. Hic aliquam corrupti qui. Dicta dolor labore ut soluta vel.

Nostrum et minus minus omnis eius nemo. Voluptatem minus unde aut. Dolores nostrum maxime voluptatibus dicta voluptatem explicabo repudiandae eum. Ut rerum temporibus voluptates praesentium qui quae voluptates.",Nigeria,Yobe,,"9374 Kellen Pines Apt. 241
South Robb, RI 89669",(512) 992-1511 x764,,,1,31017,66555,,,2018-05-14 11:51:55,2018-05-14 11:51:55
