1,eb6786f5fc5728e135196ad10590a114,bins.kailee,Cleveland,Osinski,frieda47@example.net,1996-08-29 20:21:40,"Iste vero ipsum optio quo libero. Excepturi totam quia tempora doloribus adipisci eligendi architecto. Illo enim porro necessitatibus temporibus. Natus ducimus eius quod consectetur.

Ipsam quo voluptatem et amet voluptates. Ratione ratione numquam rerum ut dolorum omnis. Ad explicabo voluptatem molestiae et ut beatae est. Voluptatibus rem officiis voluptatum possimus et ut quia. Fuga consequuntur dolorem quibusdam occaecati.",Nigeria,Ebonyi,,"29504 Garland Road
Port Loriburgh, AL 90786",+1.874.478.8325,,,5,44861,97166,,,2018-05-14 11:51:06,2018-05-14 11:51:06
2,ba0a623ff3a04531a99362914b20563e,kathryne.beier,Elbert,Wyman,larmstrong@example.org,1990-10-06 02:06:55,"Saepe ut aut non. Repellat nihil repellat sit nostrum occaecati voluptate natus.

Aut qui fugiat sapiente eius eveniet velit. Nisi delectus amet quo vitae eaque earum voluptatem praesentium.",Nigeria,Kano,,"6912 Alysa Row
Hyattfort, PA 22016-8372",+1.328.438.0978,,,0,32596,70667,,,2018-05-14 11:51:06,2018-05-14 11:51:06
3,45359991817e1256e30f3ea9eabcc147,alyce43,Simone,Hegmann,geoffrey.upton@example.com,1993-05-29 01:37:07,"Illum enim occaecati vitae et odio. Ut molestias placeat consequatur voluptatibus vitae voluptatum veniam. Accusamus minima qui eaque illo. Cupiditate odio aut numquam voluptate quis.

Suscipit quia et vero eveniet. Unde et aut illum quia eligendi optio voluptas. Ut voluptatem voluptatem id.",Nigeria,Nasarawa,,"42815 Haley Meadow Apt. 834
Benedictton, NY 91038-9628",(721) 206-9257 x62089,,,6,42038,63097,,,2018-05-14 11:51:06,2018-05-14 11:51:06
4,ae7a5a1bed94914c1df38c4494bb3766,schiller.lexus,Gina,Schowalter,mckenna.dietrich@example.com,1985-07-07 18:06:32,"A adipisci distinctio molestiae cupiditate. Voluptatem sit laborum commodi maiores. Iure impedit possimus harum officia quisquam fugit fugit. Nisi minus adipisci excepturi sit sapiente.

Itaque reiciendis qui rerum fugiat enim. Sequi corporis non eligendi occaecati est animi sapiente id. Voluptate nobis ducimus qui eius incidunt. Nemo fugiat rerum rerum tenetur ab.",Nigeria,Edo,,"257 Kraig Expressway
Lake Veda, SD 37702",+1.371.629.9266,,,8,37561,63579,,,2018-05-14 11:51:06,2018-05-14 11:51:06
5,102ca5458ffdc79dc5b4b798efb33990,hailey.langosh,Lavern,DuBuque,trey31@example.org,1991-11-15 06:15:04,"Et libero necessitatibus voluptatem earum recusandae. Dolorem est rerum debitis soluta repellat ipsa consequatur. Pariatur in maxime voluptatem alias esse. Laudantium dicta laboriosam molestias libero voluptates.

Incidunt quasi facilis sit nisi fugiat amet. Hic omnis est et adipisci voluptatem similique voluptatibus placeat. Placeat distinctio sint ut facilis molestiae repellat. Sit pariatur odio et. Aut sit aut optio.",Nigeria,Cross River,,"8936 Zulauf Pine Apt. 861
Port Allan, AL 55401-5618",(443) 619-7468,,,3,43856,53821,,,2018-05-14 11:51:07,2018-05-14 11:51:07
6,6396f345753e1791c7d865ebe9ed87a9,zemlak.trycia,Johathan,Franecki,qadams@example.org,1985-11-19 11:11:08,"Voluptatibus dolores omnis nobis natus dolorem molestiae aut. Quis ex reprehenderit autem dicta a.

Qui qui et dicta aut porro velit ut. Porro tenetur veritatis hic eveniet quidem. Eos quis dicta ea ut quaerat officia velit. Et qui voluptate distinctio ut accusantium veniam.",Nigeria,Kaduna,,"42502 Lubowitz Avenue Suite 447
Sheilamouth, AK 14326-1733",(691) 305-6087,,,9,30222,97797,,,2018-05-14 11:51:07,2018-05-14 11:51:07
7,744577cc6f08fa64494bbc15df48008d,brenden92,Quinton,Rath,feeney.cordia@example.com,1997-11-06 06:35:14,"Explicabo sed est nihil. Quo blanditiis veritatis delectus quis modi quia quaerat. Autem officiis et et in illo et.

Harum cumque magnam voluptatem recusandae temporibus officia officia. Excepturi id architecto facere praesentium ea sed. Dicta sed vitae rem.",Nigeria,Anambra,,"2148 Einar Wall Suite 082
Moorechester, ID 04440",850.417.3090 x4054,,,1,30716,66912,,,2018-05-14 11:51:07,2018-05-14 11:51:07
8,4925f809e63123bf06d9d69a5b0ab574,delmer.walker,Devan,Satterfield,bahringer.tiara@example.org,1994-01-12 13:56:13,"Exercitationem sequi amet ex deserunt. Aut quibusdam ex harum nostrum. Impedit ut itaque molestiae consequuntur quia quidem quia.

Eos assumenda ea ex non at. Est fugit voluptatem atque repellat. Iusto rem et sapiente ullam. Nesciunt ut aspernatur sit est.",Nigeria,Yobe,,"12749 Cruickshank Drive Suite 012
East Harryburgh, MS 53460-4751",334-572-6335,,,7,43053,71848,,,2018-05-14 11:51:07,2018-05-14 11:51:07
9,54ccec4f8d1a7484a1d7aa09abcfe37f,jaquelin.cartwright,Verla,Harvey,bode.darrion@example.com,1994-01-18 15:43:12,"Ipsa est repellat sapiente fugiat. Repellendus nihil nulla libero. Dignissimos dicta soluta neque quae.

Aut aut saepe consequatur veniam occaecati modi. Quae officiis autem et quasi at ullam quisquam. Voluptate ut voluptatem eum incidunt voluptas porro aut laudantium. Hic voluptas quae ipsum itaque porro.",Nigeria,Kano,,"8618 Bogan Brooks
New Donnellview, OR 93650",519.782.7786,,,0,38099,82802,,,2018-05-14 11:51:07,2018-05-14 11:51:07
10,31c8d9e9bc6f5000f4eb2d895b9bf1d4,rkoepp,Maida,Rippin,sdaniel@example.com,1986-01-20 20:58:23,"Doloremque voluptatem eos dicta minus repellendus. Quae tenetur pariatur inventore quos et. Neque quas laudantium architecto nobis aut.

Id minima eum impedit impedit doloremque eaque. Et qui eos velit quos ea veritatis qui. Ab beatae sapiente quia qui quasi. Nobis necessitatibus cupiditate aliquid sequi.",Nigeria,Taraba,,"326 Mervin Passage Apt. 356
Kadenhaven, WA 99092-7701",(602) 484-3846 x1828,,,7,39885,76705,,,2018-05-14 11:51:07,2018-05-14 11:51:07
11,f2063e152d123d38652e66c890e169b3,murl40,Hudson,Haley,zetta94@example.com,1994-06-18 23:00:04,"Excepturi mollitia quis rerum iure maxime qui. Ullam explicabo dolores molestias ad consequuntur odio. Sed et quo eum assumenda unde et enim occaecati.

Consequatur numquam assumenda id totam dignissimos quidem eos nihil. Aut ullam quis pariatur corrupti eaque. Quia blanditiis dolorem iusto soluta eos. Et culpa velit quod officia modi.",Nigeria,Lagos,,"173 Nya Courts Suite 072
Farrellchester, ME 94555-1718",1-592-399-9749,,,8,34574,74077,,,2018-05-14 11:51:08,2018-05-14 11:51:08
12,287b144cdba5a8a6050ce554c52c4887,kennith.turcotte,Antonette,Carroll,marcos.bashirian@example.net,1996-02-16 04:37:37,"Debitis quis ab voluptas omnis inventore qui illum. Quibusdam sed doloremque praesentium dolores tempora officia sunt voluptate. Facere cum et odio officia. Unde et et excepturi earum.

Nihil aut magni et corrupti porro fugiat sit. Ut saepe ex vitae quos ut dicta maiores.",Nigeria,Lagos,,"822 Fisher Road Suite 843
Deanchester, CO 38115-9098",959-391-2541,,,10,45266,59239,,,2018-05-14 11:51:08,2018-05-14 11:51:08
13,bd2fd377c8bc88ca0146309dac3be49f,alford74,Mortimer,Schimmel,ozboncak@example.com,1990-09-06 07:58:15,"Aut natus consequatur vero praesentium. Rerum itaque dolorem commodi quo. Quo praesentium sunt neque fugiat in. Ratione illum et accusantium fugiat.

Eaque sunt iste ex dicta. Ut voluptas inventore aspernatur sit magni vitae. Sit qui omnis facilis dolor distinctio laboriosam. Iusto sunt expedita aut maiores molestiae. Porro laboriosam eius nemo facere quaerat in molestiae.",Nigeria,Lagos,,"7514 Arvel Pike
Jacobiborough, LA 47505",(785) 218-3742,,,3,30161,81350,,,2018-05-14 11:51:08,2018-05-14 11:51:08
14,b9343f6bcbdc03f0298db5592d7ce737,gussie18,Jana,Monahan,hyatt.bud@example.org,1991-05-15 06:49:59,"Perspiciatis provident cum voluptate facilis distinctio sed. Magni nihil nisi velit repellat blanditiis error mollitia non. Et et illum minus optio consectetur non rerum.

Aut minus ea impedit natus aut beatae unde. Dolorem esse qui consectetur amet at beatae qui.",Nigeria,Kwara,,"5442 Wehner Mountain
Mittieton, NV 39060",+1-245-619-5786,,,7,39251,59574,,,2018-05-14 11:51:08,2018-05-14 11:51:08
15,ee7196c3ddd2766257f516ec888afdcd,moore.jennyfer,Hattie,Corkery,tremblay.hollis@example.net,1990-01-31 05:57:24,"Itaque est pariatur dolores ut totam et aspernatur. Et aliquam harum laboriosam soluta corrupti tenetur. Nihil architecto blanditiis vero iure. Expedita accusantium quo odio vel possimus consequatur. Quia odit aliquid aut expedita.

Eius totam qui in vitae perspiciatis voluptatum nostrum. Minima et vero blanditiis distinctio quia maxime maiores. Quia ipsum iure cumque exercitationem. Qui impedit quo mollitia et ad enim quos.",Nigeria,Enugu,,"70649 Lauretta Roads Apt. 629
West Elzamouth, FL 59098",(715) 361-8375 x7843,,,4,32101,88119,,,2018-05-14 11:51:08,2018-05-14 11:51:08
16,72ae974c80dd54ed4e0ba1693929d2da,jamison.block,Ilene,Spencer,farrell.brennan@example.org,1988-08-15 17:50:23,"Similique ex velit non. Reiciendis facilis non magnam consectetur tempore. Corrupti voluptatum itaque in ut ut quas enim.

Est consequatur sed est consequatur quis error. Ducimus dicta eaque consectetur explicabo id et alias. Quia aut id distinctio dolor dignissimos voluptatem.",Nigeria,Ondo,,"6034 Powlowski Mission Apt. 681
Tobymouth, MN 58203",1-335-560-8156 x7191,,,1,32247,52229,,,2018-05-14 11:51:09,2018-05-14 11:51:09
17,563c5e658c036fb00618939be4db9bf5,richie.aufderhar,Bobby,Bednar,flatley.nedra@example.com,1990-05-08 19:01:15,"Eius et illum consequatur a quia adipisci qui. Quo minus eligendi eius inventore autem asperiores et. Enim inventore ea optio adipisci dolor iure aut quaerat. Ullam sapiente magnam doloribus maxime exercitationem ducimus.

Labore et possimus velit quis ex in eum. Accusantium ea quia debitis et exercitationem doloremque. Id vero odio provident pariatur illum quidem autem mollitia.",Nigeria,Bayelsa,,"2649 Gia Port Apt. 345
West Abigail, NY 43029",(209) 372-2111 x2956,,,8,47282,87108,,,2018-05-14 11:51:09,2018-05-14 11:51:09
18,7aa8f864fd745a84d49be9e255226681,ghaley,Junior,Renner,bratke@example.org,1984-11-21 16:08:00,"Et quia id in et quo repellendus velit fuga. Assumenda consequatur quibusdam et expedita ut eos debitis. Et voluptas voluptas in accusamus.

Eum est et iusto doloribus et dicta ut. Rerum quas repudiandae sint repellendus. Voluptas molestiae voluptatibus velit voluptatem. Ea distinctio iure placeat ratione veritatis excepturi non praesentium.",Nigeria,Borno,,"5148 Katlyn Summit
Emmerichborough, MI 23779-9986",595-293-7539 x090,,,1,40110,53814,,,2018-05-14 11:51:09,2018-05-14 11:51:09
19,c51527d910ec8c1feebf1b7469dc9331,collin.oconnell,Micah,Stoltenberg,dominic.white@example.org,1996-08-04 02:01:12,"Sunt facere et omnis aut labore provident. Sapiente eligendi mollitia non porro officiis. Fugit voluptatem unde aperiam quis doloremque voluptatum et placeat. Suscipit eveniet rerum iure ut est voluptatem.

Ex facere quia facere. Porro consequuntur tenetur corporis sit molestiae atque optio. Consequatur vero et nobis et nobis maiores. Explicabo sit ea atque earum dolorem quos.",Nigeria,Kano,,"81673 Williamson Forges
East Macieville, WI 44307",798-384-8942,,,6,47855,84325,,,2018-05-14 11:51:09,2018-05-14 11:51:09
20,26f3b44c5e2325f73f2f34b615c2e824,sturner,Sheila,Barton,cdooley@example.org,1998-01-03 17:06:33,"Dignissimos non et quis dicta harum. Laudantium dolorem veniam dolor atque. Quia porro neque quasi sequi. Aut doloribus ducimus maxime ex fuga laboriosam repellat officiis.

Voluptas quos enim dolorem libero sed ea. Et et et corporis incidunt voluptatum. Ut suscipit magni impedit saepe itaque. Tempora sunt necessitatibus nihil praesentium doloribus eligendi.",Nigeria,Ekiti,,"25620 Goldner Turnpike Apt. 864
North Daphneeburgh, NE 08133",(480) 927-8679 x6446,,,9,45073,83204,,,2018-05-14 11:51:09,2018-05-14 11:51:09
21,9025068d86764e7503a38ba1be3dcd93,witting.theresia,Selena,Doyle,carroll.kunde@example.com,1993-03-09 23:56:23,"Dolores et doloribus placeat ipsa qui. Omnis atque ut aut qui. Doloremque praesentium illo enim doloribus autem. Officia sed ipsam laboriosam suscipit odit ratione aut.

Saepe et pariatur laboriosam possimus voluptate aut. Voluptas qui voluptatum minima accusamus ut iste est. Recusandae et occaecati quibusdam quia autem rerum veniam.",Nigeria,Osun,,"870 Sid Spring
South Lessie, MD 22309-9990",(930) 266-8549 x101,,,3,45444,68048,,,2018-05-14 11:51:09,2018-05-14 11:51:09
22,038c32fbc34064907f4a53a1fcd4934c,friedrich.west,Simeon,Reynolds,rheller@example.com,1992-02-18 18:41:06,"Illo iusto sunt illo adipisci et quam velit. Ut quis voluptatem quis nulla aut est consequatur soluta. Delectus quis quos aut aut. Omnis velit architecto ut.

Nobis quia pariatur eius quaerat. Voluptatem ipsum quis quibusdam autem perspiciatis explicabo. Commodi ratione molestiae modi commodi harum. Molestiae ipsam vitae qui voluptas.",Nigeria,Adamawa,,"184 Wunsch Common Apt. 772
Port Gregoriaville, IA 99368",1-459-219-4631 x14841,,,7,33634,80215,,,2018-05-14 11:51:10,2018-05-14 11:51:10
23,71d7f6b2ef365a9c03286d3433a71c5c,mac.hagenes,Mack,Stiedemann,halie.parker@example.com,1984-03-25 20:17:14,"Ducimus expedita occaecati aut vel sed temporibus vero. Et esse enim quas laboriosam maxime. Eum et id dolorem soluta enim vel.

Distinctio atque nihil sunt tempore. Illo quia aut perferendis est quos impedit soluta. Omnis dolore explicabo vel rem atque. Quibusdam rerum sit quia qui aut omnis et ipsam.",Nigeria,Gombe,,"289 Jailyn Plains
West Shanelle, AR 96001",+1-891-559-7297,,,10,36667,57608,,,2018-05-14 11:51:10,2018-05-14 11:51:10
24,8a20a74376e516bffb8e18a89eb55457,hwhite,Naomie,West,mhessel@example.com,1990-10-03 03:50:40,"Debitis ullam laboriosam nesciunt quidem voluptate consequatur magnam. Consequatur laudantium reprehenderit maiores minus minus. Maxime hic nemo et soluta molestiae repellat.

Suscipit ipsam perspiciatis veritatis soluta. Nesciunt quas soluta sit aut nisi autem. Autem adipisci delectus aut rerum. Deleniti ipsa deserunt qui optio quod.",Nigeria,Ebonyi,,"445 Corrine Fields Suite 956
Leuschkeshire, AL 76885",1-418-869-2945,,,6,39302,54168,,,2018-05-14 11:51:10,2018-05-14 11:51:10
25,4231ad780d5a727c13af48e5667734cb,kunze.lacey,Hildegard,Cremin,izaiah.morissette@example.org,1984-09-11 17:48:04,"Est eum ut sint magni odio ea. Et ex laboriosam sed aut dolore deleniti eos. Esse explicabo rerum et eos. Ipsa assumenda doloremque officiis a.

Unde ut quis eum omnis ex omnis tempora. Iure consequatur nihil esse et in nihil. Doloribus et praesentium est mollitia quis expedita numquam.",Nigeria,Ondo,,"8342 Nickolas Junction
West Shannonfort, LA 12768-7506",1-661-677-2158 x6901,,,8,34980,57198,,,2018-05-14 11:51:10,2018-05-14 11:51:10
26,ad6d8f4f80a83844fa7ea35aeca26214,kristofer51,Telly,Corwin,yrenner@example.org,1988-01-14 11:30:47,"Hic dolores quis et impedit aut. Fuga at nihil quo amet. Cumque laboriosam neque harum corrupti sed commodi. Odio sit nulla explicabo aut quasi voluptatem sunt rerum.

Quo dolore accusantium quo. Eius placeat laudantium nihil sunt voluptas necessitatibus dolorem. Dignissimos itaque illum unde. Repellat qui in eaque eum dicta. Necessitatibus in recusandae aliquam omnis aspernatur aspernatur.",Nigeria,Ondo,,"32805 Renner Manors
East Iliana, OR 19525-7216",(984) 647-6392 x04615,,,4,33639,80146,,,2018-05-14 11:51:10,2018-05-14 11:51:10
27,2ba06af28ecc713383b87477f7c4806f,avandervort,Laron,Erdman,cade.krajcik@example.net,1993-07-17 07:39:40,"Sed hic delectus et cumque consequatur voluptatibus quis. Nam possimus est ullam vitae. Et non voluptas reiciendis natus.

Voluptatem quisquam nobis nisi soluta. Expedita et dolores maiores aut. Iusto dolorem esse incidunt. Consectetur provident quo optio et.",Nigeria,Kano,,"7379 Christina Rapid Apt. 292
Wisokychester, TX 11911-5015",(992) 378-6974,,,2,37709,81872,,,2018-05-14 11:51:11,2018-05-14 11:51:11
28,a9f12380ea9e9717fae2e146ca15485b,murray.selmer,Rosalee,Johnson,xavier93@example.org,1987-07-28 20:33:34,"Qui molestiae cupiditate autem ut. Minus repudiandae quasi velit tenetur. Voluptas rerum nisi saepe non corrupti nulla fugit.

Aperiam nam neque eum inventore ex. Eum ut sapiente qui. Et tempore modi eum vel non distinctio. Tenetur ut architecto officia fuga sed magnam eos.",Nigeria,Kogi,,"874 Nora Stravenue
Westonfurt, WV 27927",786.977.4182 x3523,,,4,45654,55233,,,2018-05-14 11:51:11,2018-05-14 11:51:11
29,abecacf5cc516c246cf40c7db1cce0ca,fschumm,Vergie,Morissette,durgan.libby@example.com,1992-09-09 18:32:12,"Quis enim quidem vero delectus quia ipsum quisquam. Autem beatae deserunt quod voluptatem omnis. Asperiores consectetur sed dolorem dicta consectetur.

Corporis laborum accusamus sequi atque fugiat placeat cum. Quis quis quisquam eligendi consequatur aut. Velit voluptate sint voluptatibus qui molestiae in necessitatibus.",Nigeria,Kwara,,"45867 Luigi Cove Suite 441
Wellingtonport, NV 20612-0634",+1.813.951.3105,,,9,48983,86134,,,2018-05-14 11:51:11,2018-05-14 11:51:11
30,ef27c54c3b86d6b383aeff2a7c5f2ef0,djacobs,Meagan,Hyatt,hoppe.aida@example.org,1993-06-06 01:39:20,"Similique repellat rerum quibusdam sed maiores tempora deserunt. Nisi quia earum illum et voluptatum. Itaque totam velit qui vitae qui. Officiis est voluptas id deserunt et qui. Et quis aut praesentium eveniet quod.

Voluptatem labore eum rerum rerum. Consequatur rerum dolorum provident rerum a sequi nemo. Temporibus voluptatibus ut et et quos natus aut perferendis. Deleniti voluptatem sit est odio.",Nigeria,Bauchi,,"463 Dante Ports
New Danny, IL 02013-7863",215-280-0848 x527,,,0,31906,85139,,,2018-05-14 11:51:11,2018-05-14 11:51:11
31,323f5efe8ce8cd4070f9fc4f426d68a8,tziemann,Gabriella,Grady,geoffrey.flatley@example.net,1992-04-18 08:23:51,"Id eum quia et error voluptates. Et pariatur fugit ex. Blanditiis voluptas officiis non porro. Totam aliquid numquam rerum voluptas voluptatem qui tempora vel.

Similique eum occaecati dolorem eligendi. Placeat ipsum eos et fugit reiciendis. Qui nesciunt ullam est.",Nigeria,Plateau,,"95855 Stroman Dale
Clementside, WI 49182-1534",527-465-3671 x530,,,2,32125,70141,,,2018-05-14 11:51:11,2018-05-14 11:51:11
32,ac1a00d1ef36a90cfef976c8d6f8e401,montana75,Demario,Lakin,adrienne21@example.org,1985-09-26 08:05:25,"Sed enim veniam natus sit fugiat. Et dolores enim quos.

Eos reprehenderit ut mollitia libero neque quis facere. Eligendi ut harum distinctio voluptas dolorem. Ea molestiae voluptate et aspernatur tempora vel nihil. Et magni dolorum qui exercitationem quia id qui.",Nigeria,Borno,,"916 Madelyn Street Apt. 614
Thaddeusport, NV 93457",617-483-0940,,,4,30112,70747,,,2018-05-14 11:51:12,2018-05-14 11:51:12
33,5fea2ecb5876db43413baa59533e2819,marie.willms,Demetrius,Emard,anissa.maggio@example.com,1996-02-27 13:05:13,"Beatae reiciendis ipsa enim. Quia qui vero deleniti aspernatur. Et cupiditate et quam dolores voluptatibus magnam expedita fugit. Totam molestias voluptate dignissimos laborum nostrum.

Quia non illum eum nobis qui qui ratione corporis. Et amet voluptas consequatur consectetur sint dolor.",Nigeria,Taraba,,"95632 Sunny Road Suite 448
South Susannaport, IN 23450-5926",+1-789-744-7566,,,5,32621,85581,,,2018-05-14 11:51:12,2018-05-14 11:51:12
34,f5be1f059098a238cf28654c725a605a,davonte.gutkowski,Regan,Cronin,faye35@example.org,1997-12-29 07:13:50,"Aspernatur id voluptatum consequuntur enim. Eveniet accusantium earum labore. Quia illo at neque ut reprehenderit nobis.

Dolorem repudiandae eveniet voluptatem autem corrupti ipsam necessitatibus quae. Minus qui accusantium quisquam aut. Repellat harum quis possimus libero itaque quibusdam.",Nigeria,Edo,,"689 Ondricka Rue
Runtefurt, WA 70290-7849",+1 (437) 363-6389,,,6,39800,97142,,,2018-05-14 11:51:12,2018-05-14 11:51:12
35,b420d53d353cea972011df32a275e38f,baumbach.ulices,Betsy,Ortiz,volkman.leanna@example.org,1995-11-24 04:25:34,"Sed expedita in sit dolores. Eum ab quo error explicabo in. Illum ipsa repellendus quaerat harum corporis.

Et corporis a et nam asperiores. Ut maxime fugiat maxime commodi omnis soluta. Voluptatem et culpa dignissimos ipsa cupiditate aliquid. Sit omnis autem in cum. Eum qui eum aliquam aut.",Nigeria,Ekiti,,"1465 Lehner Divide
Heidenreichshire, NC 93531",409.869.9729,,,10,46358,89518,,,2018-05-14 11:51:12,2018-05-14 11:51:12
36,2eab4969cba519dc29566699313529d1,torey.runolfsson,Zella,Shanahan,ikris@example.com,1997-12-28 15:24:09,"Incidunt expedita aut autem. Dignissimos maiores tenetur blanditiis voluptates quo enim natus. Omnis pariatur aperiam sint ab nam.

Ea quis adipisci vero modi autem animi. Quia fugit aut quas a. Explicabo ex maxime quibusdam quasi amet maxime officia. Ad sint amet exercitationem.",Nigeria,Kebbi,,"20181 Langosh Groves Apt. 148
West Javonte, MN 62707-8091",+1 (415) 409-2642,,,0,31072,51293,,,2018-05-14 11:51:12,2018-05-14 11:51:12
37,fcac020967c16a8b3b5559fdc4208971,gdietrich,Tillman,Brown,loren.king@example.com,1986-08-24 12:32:20,"Exercitationem laboriosam laborum fuga similique. Inventore vero non architecto recusandae modi consequatur. Nihil quod sapiente ullam et ipsa. Et animi iusto eum eum eos molestias ut.

Modi temporibus in necessitatibus omnis aut et. Vitae non ducimus nulla ad. Impedit dolorem aliquid facilis quo maiores ad quia dicta. Perspiciatis reiciendis id consequatur commodi eos laborum.",Nigeria,Kaduna,,"738 Cronin Track
New Brittanyhaven, IA 84275-6974",1-650-904-9494 x044,,,7,41503,82314,,,2018-05-14 11:51:13,2018-05-14 11:51:13
38,8bafde393755f569d0c760f7a8743856,bryce.wiegand,Kylie,Durgan,hjohnston@example.com,1985-08-03 06:02:13,"Necessitatibus accusantium excepturi inventore aliquam eius. Voluptatem error ullam dolorem debitis quidem alias sequi et. Porro ipsum velit quibusdam consequatur voluptas ea.

Repudiandae voluptatem repellat laborum ut. Rerum qui iure sit in doloremque. Dolorem ut id quam voluptas dolores ipsum. Omnis minus adipisci recusandae sunt iure velit quia.",Nigeria,Bayelsa,,"9657 Gabriella Radial Suite 441
Ebertmouth, WY 42835-2361",(320) 887-6243,,,2,49644,57724,,,2018-05-14 11:51:13,2018-05-14 11:51:13
39,a1f4577f1c275340b0877fd66be88cca,monahan.bridie,Jenifer,McGlynn,sophia.mosciski@example.com,1991-12-14 21:53:01,"Exercitationem optio sed dolores consectetur. Repudiandae sunt fugit voluptates ipsam recusandae iure quibusdam quod. Quia et exercitationem quas accusamus perferendis doloribus. Quia temporibus ut quibusdam et assumenda tenetur nihil. Iusto vel et nihil aut sed quam.

Exercitationem debitis qui sint maxime. Tempora cupiditate saepe et et voluptates hic. Numquam sint eius eum id.",Nigeria,Akwa Ibom,,"63700 Kristoffer Squares Suite 390
North Melyna, AL 73664",448-719-0572,,,10,45079,53289,,,2018-05-14 11:51:13,2018-05-14 11:51:13
40,19a94710006f09997282beb0174761ed,donato40,Aimee,Doyle,mitchel84@example.com,1988-10-20 22:34:29,"Doloremque harum debitis sunt et et. Aspernatur officia nostrum molestias recusandae incidunt. Est nihil ipsam et voluptas expedita tenetur.

Ea soluta voluptatem quos aut quia et. At rem illum et sapiente repudiandae iste. Consequatur officia nobis vero est dolores commodi.",Nigeria,Taraba,,"57099 Von Crossing
New Wilfred, NM 65729",237-300-0623 x341,,,6,46511,52541,,,2018-05-14 11:51:13,2018-05-14 11:51:13
41,2394346cd03e7453372da87936fe2440,era94,Chyna,Rosenbaum,dhilll@example.org,1989-04-03 12:45:29,"Temporibus dolor et laudantium optio exercitationem tempora et eum. Eius saepe sed et eum quo fuga.

Quo est in culpa porro quia. Eveniet illo distinctio enim quos dicta aut explicabo. Qui dolorum eum est itaque. Explicabo voluptatem aperiam tempora necessitatibus cupiditate qui iste fugiat.",Nigeria,Bauchi,,"13585 Schinner Lake
Deckowshire, UT 71722",1-842-873-2747,,,7,45097,90499,,,2018-05-14 11:51:13,2018-05-14 11:51:13
42,a9312f7a2595dc03f707311f227176fd,christy70,Emie,Jaskolski,howell.roob@example.net,1996-09-15 22:11:46,"Quisquam et quidem fugiat repudiandae delectus occaecati harum. Sunt dolores et qui molestias. Dolorem quam hic vel aut rerum eos natus.

Suscipit aut non quae animi. Eos aut porro totam eos sit. Aut aut tempore harum omnis debitis et dolores.",Nigeria,Plateau,,"717 Cole Falls
Christopherside, NM 63119",(971) 806-9814,,,5,49830,86452,,,2018-05-14 11:51:14,2018-05-14 11:51:14
43,0f55731f53d2920a541d9f4946d81766,bettie.lebsack,Cletus,McClure,zfarrell@example.net,1990-07-13 14:57:30,"Voluptatem aut numquam aperiam cumque. Itaque magni et eos maiores laboriosam similique. Tenetur error tenetur beatae doloribus blanditiis fugiat nemo. Ipsa eum unde voluptatem consectetur assumenda necessitatibus minima.

Aliquid qui qui quos odio iste nisi. Velit rerum necessitatibus voluptatum rerum exercitationem sit aut.",Nigeria,Plateau,,"9809 Mabelle Plaza Suite 311
East Marjolaineport, AR 61553",(908) 344-2315 x86935,,,7,38607,50448,,,2018-05-14 11:51:14,2018-05-14 11:51:14
44,9acb7a2773c069cf69d36fa38415b5ff,jamar.bashirian,Edison,O'Hara,davis.savanah@example.org,1991-11-19 17:35:01,"Molestias perferendis blanditiis impedit fugit deleniti fuga totam. Et atque nostrum alias similique eos amet. Voluptatem est quis dicta non dignissimos quos.

Provident reiciendis a occaecati ipsam nihil quia. Eos consequuntur quod ut rerum. Et et ullam fugit fugit voluptate exercitationem blanditiis exercitationem. Voluptate voluptas quia qui ut.",Nigeria,Gombe,,"336 Russel Trace
South Samson, NY 71679-7274",602-904-4936 x140,,,4,38222,59001,,,2018-05-14 11:51:14,2018-05-14 11:51:14
45,6466c6043f123e7d7daf65d7471f7991,providenci.oberbrunner,Daisy,Crona,daryl.hane@example.org,1996-08-29 19:08:22,"Placeat est veniam ipsum. Officiis molestias reprehenderit dolor eligendi dolorem sit consequatur nemo. Ipsam voluptatem laudantium nihil porro delectus inventore autem.

Quo deserunt nam magnam nesciunt doloremque rem praesentium. Placeat non cupiditate consectetur optio expedita et ipsa. Necessitatibus dolores repudiandae aut nisi inventore. Ex rem rem voluptatem aut animi ut.",Nigeria,Ondo,,"7119 Angelina Causeway
Kelliberg, VA 24341-7276",+1.720.855.8234,,,10,45392,62012,,,2018-05-14 11:51:14,2018-05-14 11:51:14
