91,990125b870827d4ac59a2302b860bee7,ruecker.dulce,Dillan,Mosciski,dickinson.larissa@example.com,1991-08-19 03:09:45,"Velit tempore eligendi dolores. Quam sit natus voluptatem voluptatem. Illo deserunt perferendis eligendi sit ea molestiae. Molestiae pariatur tenetur nisi sunt totam.

Enim non dolorum vitae consequatur aperiam. Totam est doloribus rerum dolores libero impedit laudantium mollitia.",Nigeria,Lagos,,"823 Ona Path
Selinatown, LA 43723",+1-936-761-3301,,,1,46564,90467,,,2018-05-14 11:51:22,2018-05-14 11:51:22
92,5e71e963333f56e462c3cf5fbbe195fb,mustafa91,Rickie,Heathcote,taurean63@example.com,1987-06-20 20:20:56,"Aut dolorem ut qui et nemo sit non. Voluptas maxime doloribus rerum praesentium. Eos saepe eum et ea expedita et doloremque.

Excepturi ipsam molestiae est. Illo est aliquam esse numquam voluptatibus animi.",Nigeria,Sokoto,,"9851 Ward Parkway Apt. 896
Lake Lysannebury, NC 46552",646.650.5323,,,7,40376,58037,,,2018-05-14 11:51:23,2018-05-14 11:51:23
93,167e91f32b8981785d65d6ae001ff2c1,kkoch,Virgil,Leuschke,aida.feest@example.org,1988-03-28 20:12:25,"Nisi non ut qui ipsum nihil alias esse. Quia ut quae rem est sapiente minus sequi. In placeat est enim perspiciatis ut quisquam qui odit.

Voluptas quas aut ex quam repellendus. Culpa autem voluptatem aut est. Voluptas libero quo suscipit perferendis ad.",Nigeria,Oyo,,"8910 Steuber Ports Apt. 912
North Dixie, NC 42779",239-814-3596,,,4,45007,74880,,,2018-05-14 11:51:23,2018-05-14 11:51:23
94,9e7f98fb664b96ce49e0d449d843a1bc,cremin.jovanny,Sienna,Simonis,marvin.aida@example.com,1989-09-27 22:22:57,"Totam voluptatem odio neque consequatur officiis molestiae. Repellat quibusdam eaque error hic possimus.

Et nisi cum illo neque velit. Voluptatem voluptatem libero qui temporibus quo dolorem ut. Quam adipisci eveniet doloremque sed reiciendis amet.",Nigeria,Zamfara,,"313 Javonte Village Suite 079
East Daltonview, VA 26562",1-351-438-5870 x6973,,,8,43650,68904,,,2018-05-14 11:51:23,2018-05-14 11:51:23
95,ec6a4cd07c68f357864706f2338feb19,elsa95,Thad,Erdman,hauck.chandler@example.net,1986-03-14 12:33:10,"Neque quod vel aut in quis deleniti officia eos. Quia est sed et ducimus exercitationem dolorum. Aut omnis ut sed dignissimos quia omnis ipsam. Eligendi omnis vel iure accusantium incidunt nihil.

Reiciendis cum deserunt qui sit rerum. Perferendis accusamus doloribus libero sunt quasi nulla. Quaerat esse esse quas natus.",Nigeria,Plateau,,"52957 McCullough Track Suite 863
Port Bethanyhaven, NC 51292-9341",+1-607-536-9945,,,1,48093,99384,,,2018-05-14 11:51:23,2018-05-14 11:51:23
96,6465a7adcec48d730e0edddb2f4fd76b,schiller.noemie,Greta,Tromp,alejandra75@example.com,1984-01-09 19:16:54,"Harum enim quaerat voluptatem ab minus quia corporis. Consectetur et commodi provident eveniet.

Optio occaecati ut ex culpa. Voluptatem laboriosam et reiciendis tempora et. Eos illo voluptates occaecati sequi consequatur et non. Est delectus reprehenderit id ut asperiores voluptatum.",Nigeria,Akwa Ibom,,"356 Koelpin Rue Suite 662
North Ednaview, MN 19432",1-845-881-0970,,,4,36961,62128,,,2018-05-14 11:51:23,2018-05-14 11:51:23
97,68605392c0d0259e77283b9387768167,chadrick37,Vella,Daugherty,raynor.ned@example.org,1991-12-01 09:04:04,"Repellendus iusto voluptatem saepe minus. Dicta totam amet quisquam nisi quis necessitatibus. Deserunt labore voluptatum qui officia deleniti illo quis. Iusto soluta ut et non.

Repellat numquam sed possimus ea sed est excepturi. Facere totam perferendis neque porro ut ea. Minima a ad culpa enim alias sed et. Sit quis autem molestias vero sed amet.",Nigeria,Abia,,"67890 Angelina Shore Apt. 802
Stiedemannbury, IN 23198-3353",889.551.1683 x412,,,9,42419,68252,,,2018-05-14 11:51:23,2018-05-14 11:51:23
98,86ffa42cf50d13cbafed24b24bff957c,kris.geo,Eldon,Berge,jakayla06@example.com,1983-12-08 15:50:09,"Omnis architecto autem repudiandae dicta. Placeat rem ut natus consectetur saepe. Fugit nesciunt voluptas dolor ut. Aliquid magnam tempora placeat est et rerum quod eaque.

Officia vel possimus excepturi eos. Voluptatibus nihil dolores itaque minus nostrum eos autem quisquam.",Nigeria,Ondo,,"603 Harry Turnpike
Fosterburgh, TX 78246",+1 (814) 591-5364,,,4,32171,89211,,,2018-05-14 11:51:24,2018-05-14 11:51:24
99,d4dddbe4e2a8bc77b79392e0c39a5677,noelia94,Ernest,Tremblay,kgerhold@example.com,1995-01-05 19:48:30,"Delectus nesciunt ut iure excepturi ex neque. Esse dolor sit aut consequatur provident vel. Quisquam qui quisquam natus laudantium.

Illo consequatur quo iusto. Beatae vel quia dolor unde officiis maiores. Vitae sit explicabo at officiis. Fugiat aperiam et aliquid ullam qui aut corporis.",Nigeria,Bayelsa,,"4625 Douglas Place
Port Erik, SC 61257-8934",857.608.1495 x010,,,10,36788,89971,,,2018-05-14 11:51:24,2018-05-14 11:51:24
100,b4d5df708bce8116b45afeb72f53ca46,yrippin,Wallace,Feeney,olga46@example.org,1987-04-09 12:41:32,"Sit debitis eveniet quis pariatur quo quia ea. Adipisci nisi saepe cupiditate perspiciatis. Neque excepturi rem magnam dolor eaque sit illo nihil.

Ut deserunt illo optio dignissimos suscipit quibusdam veniam. Nostrum quia placeat dolore est et doloremque. Illo qui dolorum odit et. Quae sunt ipsam quasi sed.",Nigeria,Rivers,,"358 Roma Mountains
Dachville, MD 20308",1-651-209-0465 x393,,,5,48859,67428,,,2018-05-14 11:51:24,2018-05-14 11:51:24
101,4cb223b4610747e89620b7716b6973de,fgreenfelder,Ted,Green,dietrich.mercedes@example.net,1983-06-18 11:20:31,"Nihil sunt perspiciatis eius necessitatibus minus quis. Debitis sit hic est recusandae sequi. Corrupti quae repudiandae soluta tempore minima voluptate voluptatem expedita. Id ullam ratione nihil magnam.

Deserunt aperiam tempora eos neque optio delectus. Dolor dolores repudiandae sed quasi laudantium. Repellendus temporibus incidunt qui ea. Nihil sit ipsam qui et delectus aut officiis.",Nigeria,Ebonyi,,"11295 Abbott Canyon Suite 354
Berneicemouth, NH 77372-5125",(480) 552-7885 x59001,,,1,48087,83185,,,2018-05-14 11:51:24,2018-05-14 11:51:24
102,2a62b84fa602fb6213f89c04068b7001,emmerich.mustafa,Ellen,Fisher,melisa89@example.net,1984-05-15 11:28:46,"Voluptatem earum voluptatibus ratione sequi ut rerum autem. Aut cumque et beatae vel perferendis. Corporis fugit maxime id in possimus. Quis quam accusantium ut. Nihil facere et eaque ipsa est sed.

Id aut quia perferendis ea. Praesentium aliquam praesentium sit optio veniam sed. Nemo voluptatibus neque ut necessitatibus dolorem minus. Quo in est cum.",Nigeria,Katsina,,"18819 Brekke Lock Apt. 674
Kautzerville, MA 22205",+1-867-273-9634,,,9,33435,94272,,,2018-05-14 11:51:24,2018-05-14 11:51:24
103,6b50f871a0508f215b2d1eabaaeee32a,bbechtelar,Allen,Howe,orath@example.com,1985-02-02 05:05:10,"Repellendus occaecati quos omnis impedit ea qui perferendis. Sint velit sit autem est ut aut harum. Dolorem inventore vitae est.

Dolorem et laborum ut. Provident possimus unde voluptatem quo suscipit omnis impedit nihil. Cum pariatur aliquam quia error tempore.",Nigeria,Taraba,,"1401 Jonatan Heights
Whiteview, AK 94874-3881",462.708.6002 x451,,,3,47729,76291,,,2018-05-14 11:51:24,2018-05-14 11:51:24
104,a2a22540d7d4d07a451ae51b9d903b20,schmeler.roel,Antonina,Ritchie,lmurray@example.com,1995-04-29 08:32:43,"Dolores quia fuga nam est est. Quos maxime velit reprehenderit doloremque nulla deserunt laborum. Dolores id hic quis aut.

Qui earum a voluptate et. Adipisci et ab et consequatur a non ipsam. Labore aut et numquam cupiditate sit.",Nigeria,Katsina,,"289 D'angelo Ridges Suite 463
South Rosaliaport, GA 96419-1402",+13977955846,,,7,34258,75205,,,2018-05-14 11:51:25,2018-05-14 11:51:25
105,8c7ca17ed8fc5de00e68e82c2d5c4608,ebert.shyanne,Alexandro,Lang,elmer17@example.com,1990-09-19 05:02:34,"Aut quis modi libero ut. Fugiat eum a at perferendis sed nemo. Sunt quasi minima tenetur consequatur quod ut. Quo autem non cupiditate porro neque et.

Temporibus voluptatem eligendi rem asperiores. Quaerat nisi ut assumenda omnis delectus rerum magni ut. Reprehenderit enim quia dolores in fuga eos. Eligendi culpa aut soluta ut sunt nihil illum iure.",Nigeria,Kwara,,"13947 Bruen Prairie
Kesslerland, NC 38505",653-772-9810 x43837,,,3,32415,69614,,,2018-05-14 11:51:25,2018-05-14 11:51:25
106,6dec75aac4783340f65b0558b6596938,carleton.schultz,Ayla,Anderson,tiara11@example.org,1986-04-01 20:40:35,"Ea sit temporibus blanditiis dolor error. Sed et eaque eaque maiores numquam neque. Aut nesciunt modi nihil voluptatum occaecati officiis.

Minima facere quia et dolores aliquid repudiandae sint. Fugit blanditiis similique aut ipsum harum magni. Illum ipsa quae aliquid animi ullam ab. Iste accusantium officia eum natus rerum assumenda.",Nigeria,Akwa Ibom,,"255 Reynolds Terrace
North Al, DC 10800-1722",396-342-2920 x530,,,2,35392,83816,,,2018-05-14 11:51:25,2018-05-14 11:51:25
107,a11177dcfdf5af6cf34a2797823aa130,gerhold.marie,Kacie,Gaylord,herbert.schulist@example.com,1995-12-17 11:16:08,"Quia magni sit ut reprehenderit. Enim sint sint suscipit quod.

Ex velit aliquam non quo modi accusamus sint. Consectetur cupiditate dignissimos cumque officia eos. Quia itaque enim quo quo. Provident pariatur qui eos voluptatem dolore.",Nigeria,Ondo,,"345 Yost Creek
Kiannaton, UT 38546-7455",1-919-400-4815,,,4,37613,78122,,,2018-05-14 11:51:25,2018-05-14 11:51:25
108,a8f4ba4df990a037cd6b769a8976e491,jerde.antone,Kayli,Gulgowski,leffertz@example.net,1985-03-10 02:20:41,"Et dolorem impedit reiciendis sint. Voluptatum nihil necessitatibus libero animi atque.

Consequuntur voluptatibus autem quidem alias qui tempore omnis fuga. Accusantium et et iste ut voluptates. Exercitationem est quidem sed non. Delectus cupiditate adipisci magnam omnis. Eaque eos omnis dolorum perspiciatis nesciunt quaerat ea.",Nigeria,Osun,,"240 Block Field Apt. 076
North Niashire, NC 11689-9542",(651) 458-7761,,,6,30752,55100,,,2018-05-14 11:51:25,2018-05-14 11:51:25
109,4a4e4290267be1c74ebab82747d879d5,pauline.paucek,Creola,Toy,mayert.antone@example.com,1988-05-31 21:51:24,"Autem non vel autem iure. Qui id autem nostrum eligendi eveniet perferendis vitae. Sed ducimus et quidem qui alias perferendis veritatis.

Cumque qui sunt et at voluptates vel. Temporibus sequi autem sunt non aut. Autem quam omnis numquam molestiae amet unde quia.",Nigeria,Gombe,,"780 Macejkovic Port
Mitchellside, NV 27517-7958",(460) 388-5972 x433,,,3,49498,64510,,,2018-05-14 11:51:25,2018-05-14 11:51:25
110,45a2f5af5b9623a12d00d464e8222e71,lind.abdul,Veda,Schulist,tobin26@example.com,1989-11-11 06:14:33,"Et adipisci in dolores molestiae quam aspernatur non. Qui voluptate architecto voluptate dolores atque ex. Sint rem qui id eos nisi.

Quia et qui possimus sit. Cupiditate enim occaecati assumenda dolore et quaerat molestias quisquam. Consequatur quia officiis ut ut ut unde. Nulla dolorem veniam dolor ipsum neque rerum.",Nigeria,Sokoto,,"89049 Johanna Points Apt. 925
Lake Nikkitown, FL 30325-1535",706-463-1847 x90454,,,0,40621,91210,,,2018-05-14 11:51:26,2018-05-14 11:51:26
111,1f55913ea82ce9da15ab86f4f36cd4de,schumm.stanley,Manuel,Mills,leannon.angelina@example.org,1998-04-29 09:24:05,"Magni cumque deleniti quasi. Ad et amet molestias id laboriosam. Quis similique facilis ratione aut a cupiditate. Voluptas omnis aut ex.

Accusantium unde nam expedita similique. Et aut molestiae aut soluta velit sint. Et vel accusantium qui molestias nesciunt numquam praesentium.",Nigeria,Cross River,,"28773 Robb Ferry
West Deliaport, IL 41095-4828",+18708090462,,,2,48446,82656,,,2018-05-14 11:51:26,2018-05-14 11:51:26
112,d4659a79de2a84ee4f02a19c89bdc3f2,ullrich.lia,Colton,Beatty,raquel37@example.com,1987-07-20 18:28:25,"Explicabo accusamus fugit et quis sit vitae est. Enim in dolorem molestias ut. Repellendus est est facilis eius et occaecati ipsum ab. Animi dolor rerum nemo officia.

Earum sit est et nulla voluptatem laboriosam deleniti. Voluptatem eum commodi sint tenetur voluptates ab. Sed esse ab saepe doloremque sint ullam. Fugiat laboriosam provident officiis ut.",Nigeria,Ondo,,"769 Bianka Bypass
East Heloiseport, FL 26664-5901",1-982-725-5322 x490,,,1,47617,88261,,,2018-05-14 11:51:26,2018-05-14 11:51:26
113,9e8be1a0524c51b66e7f123125bd00bf,angus.lynch,Lilla,Stokes,bheller@example.net,1992-04-13 13:29:45,"Laboriosam dolore at laboriosam officia cum cum ut impedit. Non voluptatum iste reiciendis et fuga. Consequuntur et modi adipisci magni. Aut est alias rerum voluptatem facere voluptas sint.

Quasi deleniti ipsam dolores ducimus architecto sed tenetur. Ab non aliquam natus similique qui qui. Eius est delectus dolore rerum. Doloremque dolorum praesentium dolorem libero qui quia esse nisi.",Nigeria,Taraba,,"82632 Beth Islands Suite 246
Port Jadynville, CO 86450",(459) 898-2468 x22481,,,6,45082,95568,,,2018-05-14 11:51:26,2018-05-14 11:51:26
114,06f7fce37745ed82261dbf3e31e9eee2,ebins,Hester,Huel,adolphus26@example.com,1986-06-27 06:12:13,"Molestiae aliquid consequatur qui ad. Harum commodi nesciunt et. Aut reiciendis dolorum vero qui. Sit velit quos tempora minima nulla culpa.

Dolor eos quis odio voluptatum. Sit natus non soluta facere sapiente totam distinctio. Illo ea facere sed molestiae. Dignissimos officia repudiandae voluptatum eos nostrum.",Nigeria,Ogun,,"15928 Antwon Island
Kleinfurt, HI 27567",1-910-636-5729 x280,,,5,49357,83308,,,2018-05-14 11:51:26,2018-05-14 11:51:26
115,cea045d84599f57c99ff2ca848cb3265,beer.grover,Elmo,Toy,nkilback@example.net,1983-09-29 09:42:28,"Id sit aut ipsa qui perferendis qui commodi ullam. Quam vel ex quaerat.

Itaque laudantium ab possimus est omnis molestiae asperiores. Eos perferendis non quidem rerum in magnam enim aut. Facilis cumque omnis dolore atque accusantium at pariatur porro.",Nigeria,Lagos,,"6536 Graham Greens Suite 798
South Viola, TX 96822",758.771.1636 x34248,,,1,44871,90061,,,2018-05-14 11:51:27,2018-05-14 11:51:27
116,2aa248ec531eaa02c2847c5325ffe5a2,robel.hilton,Karlie,Kling,oreilly.evelyn@example.com,1994-02-19 18:20:29,"Beatae tempora voluptatem aut commodi maxime quas sint. Cupiditate eius saepe quis voluptate in fugit. Esse at rem eaque quam facere est. Earum et dolorem quisquam laborum voluptatibus totam nesciunt.

Temporibus ex reiciendis sit commodi quisquam consequatur qui quibusdam. Deserunt reprehenderit omnis maiores veniam. Beatae sit harum quo numquam nihil ab vero. Aliquam vero sed doloribus voluptas.",Nigeria,Ondo,,"47457 Lew Harbors
Hymanmouth, LA 90636-5564",(252) 998-6418,,,3,33815,97323,,,2018-05-14 11:51:27,2018-05-14 11:51:27
117,005cd9f7b8952bc7494d64e49767a4c3,lesch.mozelle,Hanna,Brekke,gene39@example.com,1986-08-14 17:43:09,"Dolor sunt labore aliquam quo adipisci quia. Ea tempore et voluptatem perferendis accusantium aut aut. Eligendi recusandae qui qui expedita aperiam veritatis.

Enim et est ad deserunt. Voluptatem hic at quaerat enim. Sint voluptas et sit quia labore.",Nigeria,Rivers,,"24554 Dooley Junction Apt. 022
Odellshire, OK 30335-0955",776.534.4037,,,2,46767,65810,,,2018-05-14 11:51:27,2018-05-14 11:51:27
118,22620eb1c74f0bbce66b3d06dc92b6dd,margie.kuphal,Anika,Mohr,braden33@example.org,1989-10-08 12:02:27,"Magnam non placeat hic. Quia alias quod omnis pariatur et aut quae. Laborum voluptates aliquam sed sit et voluptatem itaque quia. Sint tempore qui veritatis exercitationem voluptas voluptates eos.

Quasi officia enim sed modi. Deserunt distinctio est minus incidunt. Commodi esse quia corrupti eius.",Nigeria,Kano,,"8270 Ledner Route Apt. 387
Lake Julia, DC 28158",692.902.9045 x164,,,9,36051,50778,,,2018-05-14 11:51:27,2018-05-14 11:51:27
119,9595f30d9e168a4b5ceee0d31933c599,veum.osborne,Isabel,Wisoky,jaclyn.schaden@example.com,1997-01-31 08:27:31,"Maxime at asperiores nostrum architecto accusantium ea. Quas odio id quisquam repellendus. Doloribus officiis rerum aspernatur nihil consequatur.

Est aut id odio in. Qui voluptas possimus unde placeat. Veritatis perferendis commodi quas libero et.",Nigeria,Imo,,"7334 Maggio Courts
Aristad, OK 56216-4430",1-726-348-0885 x6789,,,2,47425,69887,,,2018-05-14 11:51:27,2018-05-14 11:51:27
120,8510af9607db71c6b077c5e0dead9ee5,mabel68,Scot,Heller,hermann.nadia@example.com,1997-09-08 07:58:10,"Ipsa officia delectus minus dolore praesentium. Cum recusandae recusandae dolorum vero. Consequatur ducimus dicta et quae eaque vero. Sed necessitatibus ab odio aut asperiores minima.

Vitae asperiores exercitationem ipsum adipisci quia molestiae. Velit qui iste ut totam hic dolores nam reprehenderit. Adipisci non exercitationem vitae.",Nigeria,Bayelsa,,"458 Royce Mountains Suite 735
Merlshire, RI 14320",(634) 697-8336 x791,,,4,43600,72891,,,2018-05-14 11:51:27,2018-05-14 11:51:27
121,36b622d455b4b1a02b4057703aa5545f,della.hane,Dane,Glover,hconsidine@example.org,1988-05-19 21:26:13,"Nemo veniam magni itaque quam. Et nobis omnis adipisci velit eius vel sapiente. Cumque nihil ad sed ut iste. Similique dolor ratione voluptatem rerum.

Ex incidunt deserunt eos eum consequatur officia voluptates. Voluptatem a repellat aspernatur mollitia consequatur velit inventore. Saepe repellendus nihil non iusto aliquam.",Nigeria,Osun,,"7544 Dimitri Fort Suite 273
Lavernstad, WV 07952",1-841-873-2147,,,1,30303,67997,,,2018-05-14 11:51:28,2018-05-14 11:51:28
122,49f7f89ca9f5c7e37401e43bad2db3e6,kulas.kimberly,Idella,Sporer,jerel39@example.com,1994-07-28 22:45:39,"Aspernatur iste in explicabo. Labore sunt necessitatibus consectetur tempore.

Deserunt placeat veritatis adipisci culpa aut. Saepe est ad velit vero aut beatae enim. Natus quasi tenetur enim suscipit expedita debitis itaque qui. Praesentium expedita eveniet excepturi.",Nigeria,Edo,,"74757 Fahey Stravenue
West Melodyport, UT 52294",927-771-6074 x21639,,,3,46894,69576,,,2018-05-14 11:51:28,2018-05-14 11:51:28
123,b0c82caddb88025dd58091b5fb585a3f,freeman.swift,Jaiden,Blanda,windler.gabriel@example.org,1995-06-30 17:58:05,"Quia fuga nisi accusamus quae aliquam. Culpa impedit laborum sapiente omnis deserunt. Provident est ea est neque necessitatibus magnam.

Eum eos animi dignissimos quis suscipit ratione sint. Hic vero praesentium sint sint et vero. Aliquid dolorum ratione natus dolore consequatur sequi consectetur. Iste hic molestiae quia ut quidem et.",Nigeria,Adamawa,,"693 Steuber Hollow
North Hettie, NV 18602-7071",+1-945-264-1022,,,7,47981,94881,,,2018-05-14 11:51:28,2018-05-14 11:51:28
124,21fe9379eaf0115d8eaae726d8b3a0c8,gretchen.goyette,Claire,Lowe,ursula.kuvalis@example.org,1992-06-10 16:31:31,"Earum aliquid enim cum fuga veritatis. Libero pariatur et ipsam sequi ut quo voluptas. Et laudantium vero dolore et dolorem. Ad voluptas dignissimos omnis libero fugit corporis sit.

Ea quo quia assumenda ratione fuga. Deleniti iste quia veniam itaque ea. Fugit rerum vero qui.",Nigeria,Taraba,,"94879 Talon Shoal Apt. 427
Jadonshire, HI 79419",760.441.5750,,,7,34958,51115,,,2018-05-14 11:51:28,2018-05-14 11:51:28
125,9aa6e6bb331dad9e625b01c7b154ad62,waelchi.wilfredo,Herta,Wiegand,irice@example.org,1987-11-29 08:28:48,"Unde ipsum illo in ex et. Ipsam ea repellat aut dolorem. Alias possimus quia voluptatum velit et impedit ea.

Itaque debitis ut nostrum aut. Fugiat consequatur assumenda aut quia est exercitationem aut. Suscipit magni maiores maxime eum est. Quae voluptatem necessitatibus voluptas qui.",Nigeria,Yobe,,"34283 Mattie Tunnel
Torphyton, ME 95106",+17815670040,,,9,43268,86662,,,2018-05-14 11:51:28,2018-05-14 11:51:28
126,d5b82d04861cbd22eade7d09f89c3b63,feest.alisha,Terrill,Carroll,roger.willms@example.com,1984-03-18 18:50:57,"Commodi nostrum est quia et odio at. In magni aperiam optio ea natus. Dolore et commodi eum et deserunt.

Sapiente voluptatem dolorum veniam odit ut et. Optio quibusdam unde earum. Doloremque ea sed praesentium alias. At facere voluptas voluptas nihil.",Nigeria,Imo,,"760 Prosacco Squares
North Shane, AR 00535",771.565.5489,,,4,35277,51810,,,2018-05-14 11:51:28,2018-05-14 11:51:28
127,a1ab373a46037fc19729aa3f756392a7,weldon16,Brice,Kunde,gilbert22@example.net,1995-03-17 12:02:48,"Cupiditate recusandae et magni officiis praesentium non ipsum aut. Itaque quia placeat eos repellat. In numquam ea officiis.

Doloribus dolores quis voluptatem doloremque excepturi. Non libero id et non. Placeat aspernatur unde ratione consequatur maxime cum non.",Nigeria,Ebonyi,,"18250 Albertha Ferry
West Cristina, OK 32367-8088",(546) 916-5217 x278,,,3,49883,70056,,,2018-05-14 11:51:29,2018-05-14 11:51:29
128,2e9e09696b769e694c54b9187f2571ef,kara33,Jocelyn,Carter,hyman43@example.net,1990-06-14 10:52:27,"Ducimus porro omnis laborum voluptatem ullam. Fugiat voluptatem optio occaecati et voluptatem impedit id. Et laboriosam magnam sit at id. Quia voluptates neque ipsum deleniti ut tempore quibusdam.

Optio ea voluptatem et ipsam quibusdam voluptatum ea. Voluptatem mollitia est deleniti. Et corporis voluptatum vero doloribus dolorem.",Nigeria,Nasarawa,,"520 Kenya Glens
North Loyceburgh, IA 01116-9597",393.409.9767,,,1,32495,96408,,,2018-05-14 11:51:29,2018-05-14 11:51:29
129,bcc1d7517e1da2050b4ecc8fb56a386f,rpouros,River,Champlin,bbecker@example.com,1984-08-17 17:05:03,"Et temporibus autem reiciendis pariatur sit sunt neque. Enim aut fugiat ut aut. Distinctio consequuntur praesentium est est quo et.

Vel repudiandae saepe doloremque et vitae. Et quia aperiam rerum praesentium recusandae harum. Temporibus cum consequatur dicta voluptatem cumque. Doloremque error ut modi non dolores perspiciatis. Mollitia voluptatem quasi incidunt distinctio adipisci illum officia.",Nigeria,Kwara,,"28307 Kira Expressway
Ebertshire, TN 56007",1-728-901-7981,,,8,39531,68066,,,2018-05-14 11:51:29,2018-05-14 11:51:29
130,75591bf3de384a57771ad2451d5482c1,xoconner,River,Adams,liliane.turcotte@example.net,1991-08-07 13:03:02,"Id est saepe facilis omnis velit occaecati dolor. Id quasi mollitia ut enim. Quidem est optio unde.

Ut repellat est sunt omnis voluptatibus quod provident. Aut sed illo ipsam debitis et voluptates error deleniti. Necessitatibus nihil est aut dolores ullam est ratione. Molestiae ratione aut sint doloremque expedita ullam ratione.",Nigeria,Ogun,,"36562 Josh Extensions
Shaunburgh, AL 58608-3010",706.464.6543 x4650,,,4,43658,81285,,,2018-05-14 11:51:30,2018-05-14 11:51:30
131,97e0aa3c084aed60ebe037a7e0196c06,concepcion91,Lee,Hackett,tgleichner@example.org,1995-06-03 23:45:08,"Ut fugiat sed assumenda magni. Non voluptas esse nihil molestiae porro deserunt nisi. Debitis voluptatem doloribus nihil velit. Est vitae cumque sit quo eum.

Iure velit voluptatem vitae molestias cupiditate hic ut et. Ut debitis debitis id impedit. Ipsa placeat quia animi quaerat tempore.",Nigeria,Cross River,,"9163 Stoltenberg Key Suite 761
Larsonfurt, MT 48096-4984",517.379.8485,,,6,36909,77992,,,2018-05-14 11:51:30,2018-05-14 11:51:30
132,fc84801869c6e6bfe66653b334c7c450,renee.feest,Madison,Pagac,lhayes@example.org,1991-01-17 00:53:48,"Nesciunt cumque quasi dignissimos qui. Quia quia maxime similique eius facere animi sed vitae. Sunt sint suscipit quia vel eligendi numquam aperiam.

Dolorum facilis at non est consequatur. Odit assumenda sit ut et. Voluptatem quo blanditiis voluptatem eum qui id.",Nigeria,Lagos,,"726 Tyreek Estates
Fredericland, IL 65514-0143",1-573-495-8971,,,2,45573,60675,,,2018-05-14 11:51:30,2018-05-14 11:51:30
133,1e068fe276b9298974f44ee31544593b,ernesto.stanton,Hillary,Morissette,bins.aidan@example.com,1997-06-17 05:54:31,"Illum quae dolorum reiciendis beatae totam excepturi omnis. Dignissimos est ad aut. Suscipit dolore est qui aut. Ullam ut vitae ducimus cumque modi. Aliquam quas sed soluta ea qui fugit.

Possimus dolorem fugiat cumque minus. Aliquam ut totam nulla.",Nigeria,Jigawa,,"732 Ashly Bypass Suite 831
Velvastad, ME 37604",657.928.2795,,,6,32310,95687,,,2018-05-14 11:51:30,2018-05-14 11:51:30
134,74977d2ce1ddd0a4c0865e9b6f2f7645,arlene.botsford,Jerod,Corkery,enoch07@example.com,1992-10-13 20:29:17,"Enim officiis rerum molestias hic. Necessitatibus dolorem aliquid beatae dignissimos repudiandae sapiente. Dolor ut in nihil maiores recusandae magni dolorem.

Autem ab aut fugit. Atque et deserunt pariatur magni itaque ut. Dolor explicabo cumque id rerum nemo.",Nigeria,Jigawa,,"43515 Smitham Crossroad Apt. 127
Joshview, UT 30515-6548",760-919-2948 x9300,,,6,44493,77878,,,2018-05-14 11:51:30,2018-05-14 11:51:30
135,887b3429684f7998ede1e148d7e8b9dc,wankunding,Keira,Gorczany,chandler.kilback@example.org,1989-10-25 11:01:38,"Harum earum et saepe id rerum natus earum vel. Omnis ex aperiam id doloremque. Quidem consequuntur quasi qui. Vel beatae occaecati odio odio.

Omnis iste itaque minus optio quasi. Et eveniet quia et numquam. Aliquam non quis id rerum error nihil nemo nesciunt. Expedita aut iste error ut possimus. Minus ea dolore et mollitia.",Nigeria,Bayelsa,,"19521 Hyatt Court Apt. 373
Murrayside, DE 26893-2502",(923) 822-6770,,,5,44220,64991,,,2018-05-14 11:51:30,2018-05-14 11:51:30
136,c38427afabf314751772cc3a4c7314f5,rosina.powlowski,Nella,Schinner,yheathcote@example.org,1990-03-05 02:54:34,"In quo reprehenderit omnis nemo non omnis. Et inventore esse et eos ut. Velit corrupti similique debitis vel expedita numquam ut. Molestiae voluptatem id in hic id.

Numquam in deserunt aut ut. Unde est enim enim magnam est. Error libero accusantium vitae quo cupiditate velit. Molestiae tempora qui nobis repellendus molestiae.",Nigeria,Kaduna,,"19547 Gertrude Spring
Millerview, CT 75769-4956",1-395-227-1325,,,5,39225,86505,,,2018-05-14 11:51:31,2018-05-14 11:51:31
137,05ad89a62972fd35be59f81084164f22,emmalee.brekke,Lavon,Powlowski,bret.gleichner@example.com,1994-10-04 22:15:20,"Commodi at sit qui mollitia totam et est. Aut accusantium molestiae maxime error modi aliquid. Earum recusandae iure qui tempore et eos. Aperiam quia et necessitatibus illo non ullam nisi architecto.

Exercitationem et recusandae libero consectetur amet. Ut consequatur repudiandae ea hic et. Enim qui alias iste et similique eius saepe. Sapiente fuga id fugiat laboriosam harum qui qui.",Nigeria,Akwa Ibom,,"21550 Aliyah Cape Suite 050
New Adahmouth, SC 53038",(919) 409-9844,,,1,30309,88353,,,2018-05-14 11:51:31,2018-05-14 11:51:31
